ID,FirstName,LastName,Type,FreeFormText,Email,Integers,Reals,DateTime,PhoneNumber,Street,City,State,Zip,Country
"BAA96713-9F40-4891-B59A-2FDFD15B3975","Hedda","Vaughn","eNySylXh ixUYWE","vitae risus","Jonah@congue.us","1008551","19395352.76","11/10/2016 22:11:23","618-585-4666","60644 West Barbados Ct.","Mandan","AK","92538","Costa Rica"
"FCF48EEC-5FAC-4747-80F4-2590C7AFD6B6","Ocean","Davis","SfdwQoWBxEvAsQM","risus parturient pretium dignissim luctus at nunc augue mattis consectetuer eleifend sem dictum","Cheyenne@est.org","1919117","308946.38","11/10/2016 13:51:54","597-449-1646","91244  Comoros St.","Flagstaff","RI","73991","Thailand"
"9A10D703-93E3-4FB6-B277-227F6AFABD70","Oren","Combs","xWhIjNETD","natoque cubilia accumsan Vestibulum In porta hymenaeos nostra feugiat litora taciti tempor dolor aliquet tincidunt luctus natoque morbi purus fringilla","Deanna@Cras.net","4512124","12360028.29","11/7/2016 19:48:58","783-364-3634","56761 West Jeannette St.","Iowa City","TN","90560","Spain"
"655E0327-0DEB-4B42-9E6F-59DDF9F3687C","Salvador","Haley","hKaEtoiLJEzGf","ultrices vestibulum","Alden@aptent.com","4708917","18428673.66","11/6/2016 22:56:11","599-935-7623","36788  Cocos (Keeling) Islands Ct.","Dover","MI","11792","Kiribati"
"288BFFFA-D949-43EF-90A4-D75A2DBECCC4","Jelani","Hines","JVuGEAbR Lmfa ","elit nulla leo conubia","Aquila@nunc.com","9732412","944086.88","11/4/2016 4:04:36","158-845-9377","68417 North Austria Ln.","Baytown","UT","50362","Bouvet Island"
"15A3CDE4-85CE-43B2-B6BD-E53C6D7211D5","Bradley","Hamilton","YmSBwIovHcm","nunc imperdiet ridiculus","Shoshana@Class.org","3468653","615644.67","11/10/2016 0:04:12","719-985-1181","27683 South Micronesia St.","Norton","AK","65114","Viet Nam"
"A23E656A-8EDF-48CA-8572-C04C6D8A08F6","Roary","Carpenter","stsozqnQIblWNM","fames vulputate pede nisl lectus magna fermentum Vestibulum odio non commodo eu Curabitur neque venenatis montes","April@tincidunt.us","5352018","10689653.63","11/7/2016 10:33:59","496-140-5753","46742  Antigua and Barbuda Ln.","Lansing","SD","79820","Honduras"
"80A146DE-88F1-4C78-930E-7D334EF4EE3D","Malik","Fox","gecDvlOPtbeg","magna mi Curae per nunc per Suspendisse faucibus montes orci sed ultrices condimentum amet nibh","Xaviera@hendrerit.org","9603311","7314767.51","11/9/2016 6:36:09","721-517-7773","54992  Cambodia Ln.","Gilette","TX","37378","Mayotte"
"E2FE9CC8-9659-4E80-8C18-C4018666398E","Kirsten","Gardner","HaDmjZlGMSA","adipiscing inceptos consequat arcu vestibulum","Barry@lectus.org","7113637","16888503.29","11/10/2016 22:33:46","099-896-9110","58234 East Hannibal Blvd.","Guayama","TN","79773","Ecuador"
"06708A7C-9D4F-4B62-9D3D-CCEA160E6C58","Castor","Blankenship","kGIyXQgpfnE","facilisis Proin dui dapibus massa aliquam Etiam netus gravida","Hayden@est.us","9179755","16067162.09","11/7/2016 2:08:32","044-092-7659","8784  Oman Ct.","San Rafael","OH","70832","Faroe Islands"
"BA68E8CD-B562-4C70-ACBE-4FD664373CDD","Germane","Knowles","KeDxbvjJlZk","leo montes vel non ultrices Sed pede ridiculus conubia torquent libero turpis accumsan Lorem","Chester@Aenean.com","8656831","17410779.80","11/9/2016 18:08:51","510-454-2802","81890 West Laramie Way","Taunton","AZ","32774","Dominica"
"62920587-A4B2-4924-BDE9-9A2155885AD2","Amal","Foley","TepoCm eOF","conubia ante","Malachi@dolor.org","867924","3680238.69","11/4/2016 8:12:55","678-594-1281","68410 North Australia Ave.","Wichita Falls","NH","58866","Norway"
"10C9BBF0-F2E8-43E8-8822-CA00C74FC43D","Jin","Conner","IXrHRyAlQGh","hendrerit ante cursus enim accumsan dapibus Nullam sociis ultrices Nulla","Rosalyn@porta.gov","5290543","2077196.18","11/5/2016 21:30:18","868-968-5609","23682 West Belize St.","Santa Barbara","HI","96639","Burkina Faso"
"2BD9BA44-A488-4DAD-AAF3-9148E4FB437E","Robert","Cameron","SXOkBpaFmXsKq","netus in imperdiet rutrum convallis pretium massa netus gravida consectetuer sollicitudin iaculis egestas viverra Morbi nostra Pellentesque fermentum quam rhoncus","Carol@purus.edu","735678","16634920.62","11/8/2016 1:07:24","170-306-9909","38510 East Andorra Blvd.","Boston","IA","61121","Belgium"
"6478CE33-3D5F-4AB1-B1A8-D7B6EC56187E","Paul","Bolton","xMQNNfCFHkLitd","tempus sociosqu parturient cubilia leo ridiculus ridiculus congue sociosqu vel","Chaney@Curabitur.edu","5709633","19046283.83","11/5/2016 7:00:02","434-315-4988","18931 West Guatemala Way","Santa Fe Springs","WV","64888","Denmark"
"D66D0AAE-2EA4-43B5-875C-861AB75311A8","Leroy","Ballard","oLacBbYuNVSsSa","posuere inceptos inceptos venenatis imperdiet laoreet sagittis mus ac","Zeph@at.com","2098358","8802173.97","11/8/2016 19:39:30","942-471-6414","99462 East Hastings St.","Alameda","WV","84530","United States"
"CF2F74CC-FCE6-4CC5-AC54-34D955690D6B","Rama","Cote","YYgjaQabOqwY","Lorem Sed turpis feugiat vehicula Lorem blandit nascetur est Pellentesque sit suscipit","Jessamine@tellus.net","9693821","12364168.54","11/7/2016 2:15:28","910-433-4865","8088 North Cameroon Way","Lexington","SC","60329","Honduras"
"FDA522B1-FF8B-423D-8E27-4DA8ADF195D1","Lucy","Perry","euoHIsomKNnmNHb","ac pede scelerisque inceptos mauris eu rutrum malesuada arcu turpis nisl pharetra sit lacus Praesent et massa nonummy ridiculus tellus","Shelby@sodales.us","5010303","1673491.43","11/3/2016 2:24:17","887-975-1822","56040 North Afghanistan Ave.","Hawthorne","MS","35063","French Guiana"
"A5AD7E2F-21CD-4035-97EE-976DD5A0D9D3","Kirk","Clay","zQZrfbvggkQZ","Curabitur condimentum Class nulla penatibus dictum dui aliquam quis Pellentesque orci quis taciti ultrices quam enim Donec","Alec@mattis.net","9517256","15903549.34","11/4/2016 0:30:52","602-566-6958","86689 West Antarctica Blvd.","Del Rio","ND","29771","Kazakhstan"
"0845EAA4-FF89-4E38-9F9F-BEA3505690F4","Glenna","Rice","pXtstuLt","Nunc in posuere magnis a eleifend Integer lacus luctus aliquet","Reese@libero.net","1856141","9813729.29","11/8/2016 14:51:38","024-388-2311","33776 North Arvada Ln.","Brown Deer","DC","22148","Lebanon"
"FBF78A67-53F8-4CAD-9BAF-0FA80460EF3E","Prescott","Curry","CZqBFRJIiu","Duis luctus quis felis dui neque posuere consequat inceptos semper lorem lorem blandit lacinia iaculis","Rowan@Morbi.net","9255605","8352780.51","11/6/2016 0:14:41","381-842-6716","87010  Belarus Ave.","Klamath Falls","MI","92897","Iran, Islamic Republic of"
"74C6E8CC-67E9-4A4D-9437-029AB768D76A","Keaton","Cohen","hh dcQXCkyyp","Nulla mi quam taciti","Jael@porttitor.net","3543306","5534076.03","11/5/2016 10:59:43","275-526-3212","65126 East Nicaragua St.","Little Rock","PA","13239","Christmas Island"
"B601D5D0-1DEC-43AC-8A41-85933595B469","Wayne","Beach","mcgrXhOeuuJ","porta ridiculus non hendrerit mi urna volutpat tortor eu","Joshua@sodales.edu","3574194","2921465.56","11/3/2016 22:50:23","545-997-4481","53932  Brunei Darussalam St.","Belpre","ID","53734","Palau"
"6F8F4429-5F6B-4FA1-90CA-F140B96B02F4","Graiden","Hensley","qDlxg oxTwNX","faucibus dictum dui urna Cum pellentesque Pellentesque tristique varius et sit","Kasper@Phasellus.net","4931502","8383646.74","11/5/2016 21:48:00","438-436-9204","90678 North Del Rio Blvd.","La Verne","MO","25705","Slovakia"
"8F1E5325-0AAE-4A75-AEE6-F47293C36AC9","Beverly","Ingram","hcDWTaQusSstdl","primis consectetuer eleifend Praesent Quisque vel consectetuer convallis hymenaeos Curabitur massa torquent senectus sodales parturient","Wade@in.net","2013367","15963810.32","11/5/2016 3:54:30","985-697-9557","9185 South Virgin Islands, British Ln.","Tallahassee","AK","64101","Latvia"
"B84529AE-8882-4170-A344-12D4F4312CA8","Ori","Whitehead","vfTfJhGj","elementum Fusce Aenean Integer dapibus sollicitudin fames eleifend Ut","September@tellus.us","1277948","7253039.03","11/8/2016 2:55:16","226-166-7782","76091  Botswana Way","Jeannette","NJ","51578","Bosnia and Herzegovina"
"4D160BAD-D0A5-488F-BD61-A264799071D8","Guy","Kennedy","kfycSlvgCNrgo","Curabitur","Quemby@volutpat.us","6412832","12549568.70","11/4/2016 11:07:08","857-816-1318","3068 West Ukraine Ct.","Enid","VA","50443","Greenland"
"30C97A60-58FE-4059-83F6-A59268156D68","Carter","Mercer","ObrpxXHCtYse","Curabitur turpis lacinia feugiat gravida magnis varius dis dignissim ut Donec","Xantha@sed.com","7928768","13009100.43","11/4/2016 10:15:14","615-440-8535","53607  Blythe Way","Brockton","WI","91262","Moldova"
"9582A84F-9E72-41FA-BE71-119CB33AE4B8","William","Velez","QkKiwzjaTOIFR","taciti justo blandit vitae convallis laoreet tristique in Mauris justo elit Pellentesque bibendum facilisi in natoque","Nelle@eu.org","9814460","5567908.92","11/7/2016 14:27:55","392-460-0922","55697 North Cambodia Ct.","Tulsa","NE","03097","Angola"
"4B45A1E9-581D-4CB2-8809-C9D6AE42E160","Melvin","Graves","wLnnLkLmWK","tempus magnis tincidunt magna Proin libero morbi augue Suspendisse rhoncus venenatis consectetuer interdum viverra odio Quisque augue Etiam ligula","Erica@Nullam.us","5000419","7512061.19","11/8/2016 3:09:29","730-544-3961","17743  Pitcairn Way","Downey","TN","80430","Marshall Islands"
"45E9919C-9055-43E6-A9B8-DC29823D23C1","Galvin","Webb","TVzqXKiXz","hendrerit posuere et mattis eget risus sagittis mauris sollicitudin Integer nulla vel","Brennan@per.com","1223904","5585959.29","11/5/2016 17:32:13","231-173-8603","32085 South Holy See (Vatican City State) St.","Dover","CO","69919","Cape Verde"
"482975C7-3C38-4510-A835-0119A7EC3D67","Evangeline","Gross","rcJBwFqenFua","netus bibendum","Hammett@torquent.net","2151483","18976686.14","11/9/2016 15:01:48","518-629-3669","60405 North Antarctica Ct.","Eatontown","WA","77042","Netherlands Antilles"
"875C8F92-89E7-4287-ADB2-88FC7139AC92","Grant","Grimes","ooHbFXGfcVnduZ","ac nonummy pulvinar in orci","Calvin@vulputate.edu","5884627","17738967.25","11/4/2016 20:33:33","095-804-5825","40189 West Cody Ave.","Logan","AZ","85655","Sao Tome and Principe"
"C1D34F75-F177-42A3-80C4-41A76E0F225F","Cynthia","Maddox","IQrQJmKrTIDi","inceptos varius eget Curabitur taciti commodo Praesent quis fermentum Suspendisse magnis pretium commodo eleifend penatibus","Grant@aptent.us","720318","11144480.24","11/10/2016 14:13:25","573-472-3608","89920  French Guiana Ct.","Stafford","PA","90391","Maldives"
"287A184F-454D-4A8D-B32F-A2A38A292BFA","Berk","Knapp","TdCEdebTsSHRp","Sed laoreet condimentum venenatis tortor orci dis congue porta suscipit tempor at pulvinar Pellentesque","Nadine@ultrices.com","6671417","14076719.06","11/8/2016 14:50:51","288-768-0412","24700 North Belgium Blvd.","Ashland","ID","12316","Moldova"
"E5B13848-45C3-40E2-83AA-446612760431","Ciaran","Cantu","hdt ihIqxxW","rhoncus massa elementum In dictum habitant commodo varius aliquet euismod luctus mattis lorem interdum Cum commodo","Regan@lorem.net","4345718","13050432.57","11/8/2016 3:27:20","509-811-4270","70287  Fiji Ct.","Corvallis","SC","11991","Indonesia"
"0FA04A8C-CBA8-4B63-B66F-BCD4C824E314","Amery","Briggs","YZZqhofUzFFYOPN","massa lobortis","Steel@posuere.us","7715484","8540720.65","11/7/2016 12:49:24","996-111-7880","150 North Dickinson Blvd.","Plattsburgh","IL","65624","Indonesia"
"AA1277A0-E17B-4B6D-BF51-2C20C241ED11","John","Wilkinson","znNhBdkpNV","mauris Class ipsum nulla malesuada porttitor nostra conubia Integer eleifend ac ornare aliquam Sed aliquam","Desirae@Class.net","4711374","7634147.32","11/6/2016 7:31:27","982-990-2282","30998 West Fargo Ct.","Dunkirk","GA","91581","Kazakhstan"
"49C65731-D320-4107-99FE-43202149B821","Vance","Holloway","DRiYfu pJogk","dolor tincidunt auctor fringilla eleifend Aenean","Urielle@volutpat.com","2414397","17320722.68","11/5/2016 6:58:43","636-981-0645","36005 West Arlington Ct.","Agawam","VA","16583","Tunisia"
"3FAFDC50-25DD-4A51-9090-852C130F48C1","Clare","Mcmillan","nNYgMjvhH","Phasellus nonummy tristique ullamcorper sagittis Maecenas nonummy faucibus velit hendrerit nonummy sodales Class litora posuere non nisi Vivamus","Wyatt@mollis.edu","5395794","2255490.71","11/6/2016 18:59:58","487-183-3197","43155 South Chesapeake Ln.","Bessemer","UT","90112","Malaysia"
"B2185C66-4950-4418-B3F4-828678B287F9","Alexander","Roy","KunMVbBBVUDV","nisl mollis tellus iaculis porttitor placerat euismod nisi libero Pellentesque malesuada magnis cubilia natoque libero diam sit dictum commodo ac","Maya@lacus.com","4234208","5131240.97","11/10/2016 3:30:57","821-611-1512","89946  Iraq Ct.","Waukegan","VT","51033","Algeria"
"9EBCD095-0DCA-4CEE-9556-8ADB9C10A10A","Shelly","Figueroa","QHTlrRfHycBrwvM","morbi cubilia aliquam ligula arcu mi pretium ipsum fermentum sed In per porttitor Lorem","Ralph@faucibus.org","2078771","1319002.65","11/5/2016 23:55:49","413-176-5473","65941 South Blythe Way","Abilene","CT","84253","Madagascar"
"2621701D-35AF-4600-8498-D64DF4F67389","Chester","Mcfarland","jCNwbPJYoFJ","nunc iaculis risus diam augue diam interdum massa varius","Rigel@elementum.net","534702","19107512.88","11/6/2016 15:33:13","139-262-0189","77984 East Brookings Ave.","Opelousas","WI","27431","Dominican Republic"
"EBF8AC6D-888A-4608-B55D-2052AB6CF464","Fleur","Jefferson","fUKyIYIjRnc","Phasellus Curae enim libero Pellentesque lacinia faucibus mus conubia porttitor","Charity@laoreet.gov","7311562","6027564.28","11/8/2016 20:11:51","199-059-1116","95732 East Chile Way","Montgomery","IN","16230","Congo"
"DA91AF54-3E5F-43BF-B281-70E2E5561BA3","Odette","Ortega","xvi esWBYV ","cursus dui mi natoque tincidunt sociis euismod mauris cubilia facilisis nibh viverra a commodo facilisis Cum auctor","Celeste@ultrices.us","5863646","9205835.80","11/9/2016 5:18:43","840-389-2279","70623 North Heard Island and Mcdonald Islands Ln.","Rehoboth Beach","OR","58433","Burundi"
"965274F3-EBBE-48BB-AEA2-754860EC4A91","Colt","Haney","zAHtrERY","velit cursus accumsan nostra ultrices lacinia ornare consequat tempor Lorem ridiculus","Maris@metus.edu","9520113","4303922.44","11/5/2016 4:27:00","229-048-1539","12890 South Hawaiian Gardens Blvd.","Jenks","KY","90643","Western Sahara"
"9B145A19-D9DC-401F-9B68-15310AE38A7E","Ira","Snyder","LrokAYWgrA","sagittis Cum Mauris mus","Shelby@tristique.us","4858563","16632866.24","11/10/2016 22:58:07","079-608-4594","94066  Costa Rica St.","Midwest City","TX","72855","Martinique"
"868E4BEA-9CD8-4E1C-BE5D-A7EDB386B55E","Raja","Gordon","KnJDPXX sJPW","dolor facilisi lorem Aliquam Vivamus rhoncus venenatis magna tristique erat vehicula dolor sollicitudin Class non ut adipiscing","Eugenia@consequat.com","7097465","2094457.04","11/7/2016 7:21:06","790-575-1868","28237 South Colombia Ln.","Des Moines","OH","51875","Sri Lanka"
"0499A4B4-F579-46B2-AD4E-82CFE6F74993","Amethyst","Mccormick","eIOHroVxe","elit feugiat fames conubia facilisi posuere cursus Suspendisse ultrices ultrices id","Lila@accumsan.edu","3541983","6218615.50","11/7/2016 10:53:49","941-072-1880","16360 East Coos Bay Way","Middletown","ND","33255","Malawi"
"7360C78F-CC8B-4FF2-B40C-62ED01EE63BA","Regan","Rollins","OiCqZzMZYxnH","augue eleifend Phasellus sem","Maile@vulputate.gov","6533835","8032846.54","11/8/2016 17:53:55","598-153-7970","75383 West Anderson Way","Cedar Rapids","IA","75983","Taiwan, Province of China"
"C858277D-7BC4-498C-BDCC-D0EA8EE3A7E3","Scott","Mcintosh","gjBPWzlkTs","pellentesque Integer ut Maecenas natoque vel metus Fusce magnis lectus sem iaculis morbi ad sed Aenean auctor","Anne@dui.com","2470619","2494235.72","11/5/2016 15:47:22","231-934-3643","88735 East Brunei Darussalam Blvd.","Corvallis","WI","31910","Zimbabwe"
"CDC98E20-8982-415E-B1FF-27A538A0F892","Amy","Burks","dTpylYWn","inceptos convallis aliquet congue magnis Lorem litora","Vera@sem.gov","5764606","4868164.06","11/10/2016 10:53:45","553-894-8854","66313 West Azerbaijan Ln.","Corvallis","NC","03605","Western Sahara"
"BF58E351-6F72-4C1F-B9AF-711F0C38263E","Garth","Hooper","CiSbFZDIclnf","sed Nulla habitant gravida magna","Neil@pulvinar.com","8637224","9120150.16","11/6/2016 10:04:00","072-741-7704","76488 North France Ln.","Wilson","MN","44342","Northern Mariana Islands"
"55A09C4B-858E-4C78-A53E-E284ACAB4DE5","Amery","Hood","WnMGUSEnDmkcQ","dignissim Quisque diam sodales Ut tristique Aenean natoque Cum elit bibendum cubilia scelerisque","Emma@Mauris.us","5604802","13412232.76","11/3/2016 3:09:48","775-148-4223","73338 South South Africa St.","Vicksburg","AZ","10873","Svalbard and Jan Mayen"
"1B38A413-5C31-47A1-9C87-6CA08483A567","Kelly","Blake","IYJimUaSrOyOM","sapien consequat Fusce","Eaton@laoreet.org","2481041","13081572.89","11/5/2016 22:29:41","639-511-4204","55873 South Heard Island and Mcdonald Islands St.","Methuen","AZ","76795","Aruba"
"A0B70EEC-FECC-44D7-9F80-1DB7EBD2ECD7","Jameson","Mckay","VzXvitFsdgA","conubia rhoncus nascetur posuere sed nonummy","Audra@euismod.net","2232910","8274584.10","11/3/2016 17:28:12","251-003-1382","82269 South Nepal Ave.","Sierra Madre","DE","30661","Tanzania, United Republic of"
"6F148105-54A6-42A2-A8E7-231D0D07083A","Plato","Weiss","SzBnHqCjviIQi","dui auctor magna nascetur justo pellentesque blandit molestie ultrices arcu mollis egestas convallis taciti convallis In natoque","Regan@mus.org","7964970","19812135.34","11/6/2016 17:57:39","319-580-0175","3540 West Spain Way","Santa Clara","MS","20412","Palestinian Territory, Occupied"
"539AE6E3-EB8C-4446-929D-38A42E7E1A6C","Norman","Lewis","lJwhwglBKYovT","pellentesque vestibulum Cras orci Class morbi vitae","Keelie@semper.com","5855925","18869019.63","11/9/2016 11:45:05","910-158-5558","99934 West Tonga Ave.","Idabel","ND","50571","Bangladesh"
"00332803-A885-4BAE-A99E-9177A9CD434F","Finn","Flowers","kBMsRGWh","fames imperdiet senectus nulla dignissim tellus conubia ridiculus urna","Baker@arcu.com","1233405","3376119.60","11/3/2016 7:30:10","662-383-2635","69492 West Abilene Ct.","Charlottesville","MO","34534","Saint Vincent and The Grenadines"
"0579A60E-5305-4FBF-8910-7DC4F781BEAA","Kai","Riley","vUUMzKnlxYR","Morbi nonummy Integer sociis sapien hendrerit sagittis laoreet nunc vehicula lectus natoque lobortis In Praesent Praesent natoque nunc mollis","Joshua@Maecenas.us","8601132","7572177.53","11/5/2016 23:33:11","799-634-5458","6369 West Argentina St.","Yukon","CO","14921","Malawi"
"001336A6-82D1-4404-BAD8-F3EC4AF517E6","TaShya","Benton","LWQQANMu","lacus Quisque dolor Phasellus habitant torquent mauris diam ridiculus purus ante Integer Curae ut","Raymond@In.net","9560943","9794958.33","11/3/2016 3:49:11","568-614-8674","23753  Switzerland St.","Niagara Falls","OR","88211","Korea"
"E2DB8542-DC3F-456F-9757-32CB63AAF052","Damian","Whitney","IBJjc fj","diam nunc Class est id interdum euismod Nam Mauris Curabitur venenatis dolor Donec quis Curabitur est","Xaviera@litora.org","5549907","8834904.27","11/10/2016 15:27:35","710-376-6765","96521 South Kiribati Ln.","Edina","IN","45443","Lithuania"
"684085BA-AF71-49DE-AB85-E0115EB69927","Caryn","Harrington","qlfgbnTODm","fringilla vestibulum Vestibulum lacinia luctus et felis euismod risus in lacinia","Jesse@per.gov","7541008","19593116.50","11/10/2016 3:33:31","502-938-5281","56796  Galveston St.","Lock Haven","NC","71482","Switzerland"
"60554D7A-775D-449C-B725-28F0C229A740","Kasimir","Hardy","UN PVXwZKygFlC","Aenean varius Fusce nisl est convallis","Micah@eu.net","2703370","13890624.30","11/8/2016 20:12:42","270-382-2089","37313 South Kiribati Ave.","Fredericksburg","AK","30960","Saint Helena"
"E6ED462E-B7C8-47F1-BCDA-3492FABE6218","Quinn","Frank","ippaEjosmcWrklc","nulla tellus pharetra habitant taciti vestibulum Proin magnis Cras fringilla Class purus per per et lectus","Honorato@non.org","7499366","587812.48","11/5/2016 1:50:47","087-457-2941","86226 North Canada Ave.","Hazleton","WV","87604","Namibia"
"1435AD7D-D60E-44CD-83EC-A897A613BD5C","Rama","Griffith","TcWmGNJsYdVWm","Vestibulum turpis lobortis convallis neque amet lacinia dignissim hymenaeos porttitor Aenean nibh dapibus sollicitudin Nulla","Mariko@ante.edu","7284312","1659753.53","11/4/2016 19:26:18","415-608-4083","90974 East Comoros Ave.","Eugene","MO","67608","Iran, Islamic Republic of"
"DDF4731A-78DB-44AB-A66F-E9B3B2363133","Silas","Velez","Ud rmuawqJV","Duis sit dis ridiculus quam non eu venenatis fames Lorem eget Aliquam nibh libero tristique Nam Sed Sed","Brenden@at.org","231695","19186112.65","11/10/2016 21:14:17","885-262-4740","34737  Elko Blvd.","Guánica","ID","13947","Saint Vincent and The Grenadines"
"5B3AB662-FCC6-4F0C-A485-178F5808D8E7","MacKensie","Sherman","zdfChRbOJFrgQdG","sociis","Sage@aliquam.net","6146391","17068827.45","11/6/2016 6:48:56","739-395-2867","60256 South Danbury Ave.","Prescott","CA","83370","Greece"
"1F1B5B5E-FB50-4417-BC2C-77AACA1EF585","Jerome","Hartman","GvXdTj XqeXUTve","fames a nisl Mauris eget est Phasellus Cras montes justo arcu","Andrew@consequat.gov","4398871","16746005.82","11/4/2016 13:03:24","461-454-9081","56964 South Gabon Way","Valdosta","CO","62311","Libyan Arab Jamahiriya"
"37C29065-821B-4599-B25D-F3CD5318CB6E","Judah","Merritt","YwpoSWqnsz ey","Aliquam erat ultricies gravida at Pellentesque taciti senectus sollicitudin nascetur Aenean enim montes libero gravida parturient laoreet iaculis","Norman@Integer.net","8673517","9938643.43","11/8/2016 10:53:27","104-228-8866","71671 West Pakistan Blvd.","Beverly","WV","53850","Malta"
"EA6F8E37-4FC4-4499-A218-4B9817600EF4","Chase","Huffman","mOJByczhK","sapien nulla turpis mus diam leo Cum feugiat luctus euismod nostra tellus","Fay@In.edu","9777195","5447729.86","11/4/2016 17:55:44","262-494-4504","39544 West Fond du Lac Ln.","Gold Beach","NM","87901","Belarus"
"72AE5BC1-B049-48E9-B93C-2D156853A323","Laith","Carver","gWklgWBQjBeqmn","quis sociosqu Duis nostra Donec nonummy","Jordan@leo.edu","3161004","6467989.01","11/3/2016 8:33:57","387-654-9900","87825  Murrieta Way","Oak Ridge","AK","70774","British Indian Ocean Territory"
"3D834A5C-8C5F-442B-823C-C9F2E71CA753","Kenyon","Price","ch pl UAZiPh","vitae ante nunc Integer porta Maecenas est Nulla nostra sociosqu at","Olivia@morbi.edu","9426683","16604247.40","11/3/2016 21:16:52","546-952-0027","48295 East Edmond Way","Rancho Cordova","NJ","74950","Greece"
"54B07E53-6497-45A3-B573-4399D30F43A7","Kiayada","Mcclure","zFncQxl K","sem auctor hendrerit tellus litora orci dictum Fusce pulvinar velit nunc viverra accumsan fames arcu metus Mauris taciti","Shana@lorem.us","9421875","2228103.57","11/3/2016 22:59:26","150-670-7843","91876  Viet Nam Way","Minnetonka","CT","20030","Saint Vincent and The Grenadines"
"8A3681B1-AC8E-40DD-88E7-E8199FEAF190","Murphy","Underwood","agpiUjqqPA KmP","nunc ridiculus ante turpis vehicula Praesent elementum placerat metus Donec Donec","Meghan@nostra.net","4912736","14092299.27","11/3/2016 4:13:44","125-747-2958","74116 South Finland Blvd.","Newcastle","NH","02306","Papua New Guinea"
"75A67F18-DF45-42B6-B79F-6C1C7B0A0802","Belle","Stout","GpSaHGLvN","lectus Nunc placerat felis auctor lacus tellus","Aurelia@dictum.net","8423324","12594639.71","11/5/2016 3:37:17","213-813-4442","77954 East Davenport Ct.","Hampton","MD","71709","Argentina"
"FCF1D503-644C-4D7A-9A19-1262BAA6E409","Chandler","Giles","kHtmmaeTW","sociosqu vulputate taciti massa dis elementum ligula cubilia justo Vestibulum","Benedict@Sed.net","6426089","9693273.46","11/10/2016 6:57:29","290-812-1791","91960 South New Caledonia Blvd.","Frederick","ID","00695","Croatia"
"224FE29F-45D3-49E2-8416-1BD28769E24E","Jakeem","Mclean","undjJLbbpagQ","Fusce ligula Nunc feugiat ad euismod elementum vehicula vehicula arcu per mus ac","Keely@convallis.org","932483","18357140.15","11/3/2016 5:02:53","113-587-0004","19071 West Aruba Way","Plantation","VA","04586","Zambia"
"B3C345AA-BA67-46EA-B388-764F9F171B84","Jenette","May","fXggiqORRuO","conubia Vestibulum pretium","Cleo@habitant.org","3181181","9854550.82","11/8/2016 10:10:48","318-639-7570","8155 South Monroe Way","Grand Junction","NJ","09113","Senegal"
"7278D605-27F7-4D05-9378-FCF2A0808A47","Giselle","Raymond","gswg ENDtuK","euismod tempor enim sapien metus sodales convallis Ut luctus morbi risus","Adara@conubia.com","7477316","4773262.46","11/8/2016 11:11:27","700-707-2405","32535 East Angola Way","Dodge City","RI","28500","Venezuela"
"AA49CAF3-CB63-4DB7-8A63-90193076D305","Stacey","Little","wspRAsxaTFx","fames convallis sem lorem orci malesuada Curae","Gisela@vitae.org","8671260","11363797.34","11/6/2016 19:54:14","732-268-3336","59569  Samoa St.","Little Rock","NC","34364","Namibia"
"7DFBB873-A1C4-4249-9B14-6252CA217BD7","Chastity","Watts","qeDsdBOdjWg Y","commodo Praesent sapien varius erat Cum massa metus suscipit blandit mi lectus ridiculus","Lois@netus.net","5669787","1959650.05","11/9/2016 0:05:25","908-683-4441","92048  Ethiopia Ct.","Waltham","KY","77494","New Zealand"
"C71CC25F-304F-4C5C-9242-AC44E908F0AA","Roth","Cole","iqBUXMhqchd","iaculis","Joseph@nascetur.us","648074","3817428.22","11/10/2016 23:17:56","876-405-5009","7609 West United States Way","Visalia","MI","90739","Cambodia"
"FF69E2D0-9093-4D7B-8311-74E55318538D","Kameko","Silva"," DmISBzjWw","mus non commodo tempus posuere dapibus Sed velit volutpat bibendum","Camilla@mattis.com","8380191","16032438.21","11/4/2016 18:06:57","546-424-9516","20785 East Norway Ct.","Hopkinsville","WY","07068","Kyrgyzstan"
"7827C6FA-BE26-435A-B8E5-44C660CEDAB4","Camille","Byrd","C XEOHNSbfmdp q","sollicitudin vestibulum sit quam sem erat tristique ante lectus rhoncus volutpat tempor Sed feugiat est eget Nunc","Cassidy@Aenean.gov","1181685","16058227.63","11/9/2016 23:06:54","650-858-3103","28559 East Austria Ave.","Morgantown","AL","19061","Uzbekistan"
"D1401227-F401-40EE-8106-C6D075A1C208","Xavier","Randall","ixCVDmIXSez","et urna montes ipsum","Keefe@mauris.gov","4201414","8821058.88","11/5/2016 19:40:01","240-324-5690","79632 North Cambodia Way","Laguna Woods","LA","90657","Falkland Islands (Malvinas)"
"792CD04A-5331-49EA-A58F-BF5993E15950","Emmanuel","Griffith","AdatVjVu","bibendum dui torquent mollis luctus","Ashely@sociosqu.com","6499711","12577123.54","11/4/2016 17:23:14","068-650-7518","18921 North Aruba St.","Nome","KS","45404","Thailand"
