ID,FirstName,LastName,Type,FreeFormText,Email,Integers,Reals,DateTime,PhoneNumber,Street,City,State,Zip,Country
"EAF0420F-93E8-4182-BF8F-A09C87170C9E","Cameron","Rowe","CoBGLCrKk","magnis","Shaeleigh@fringilla.gov","4043637","10974231.31","11/5/2016 10:38:35","437-461-6404","67010 North Saint Pierre and Miquelon Ave.","Huntsville","MA","21881","Burundi"
"A4C49925-DFA4-4DFD-B3BD-435135EFD836","Sasha","Butler","xfgOINTDikM","pellentesque ullamcorper est nec senectus tristique","Trevor@Sed.org","522893","1233138.81","11/3/2016 14:49:14","979-361-7158","63235 South Liberia Way","Merced","MO","30044","Brunei Darussalam"
"55DA09AF-5685-494D-89C6-122858B25DC8","Cally","Spence","P zLAHcLSME","eget Morbi at","Ori@pretium.com","7422232","5095442.40","11/7/2016 4:21:00","813-849-2359","7650 North Kent Ave.","El Segundo","NJ","08734","Heard Island and Mcdonald Islands"
"2EB7FC3E-8538-435E-AF7A-8BEA7021157A","Daphne","Mack","HpexKEuHbENi","libero tempus nibh molestie Lorem nibh Maecenas ad faucibus metus posuere Cum dolor dictum In laoreet torquent","Wilma@faucibus.net","4759241","4848590.67","11/3/2016 12:33:27","446-963-7682","45922 West Billings St.","Poughkeepsie","WI","03618","Trinidad and Tobago"
"7DEC3FF1-1CDA-4A58-8F34-6720108ACAF0","Bert","Bender","DasDVAWnehjV","scelerisque sed diam pharetra id netus egestas ante porttitor Duis eu mus lectus","Maile@sapien.us","4672119","1023419.62","11/8/2016 1:25:13","094-248-2845","29857 West Botswana Ln.","Cumberland","AK","71503","Haiti"
"17ED0096-200F-48D5-A07D-79E49F3EBCF6","Veronica","Massey"," PvHeJZF","ullamcorper tristique cursus In urna Donec scelerisque ante ullamcorper commodo conubia lectus dis","Abraham@elementum.gov","8678556","18070002.61","11/8/2016 5:39:18","815-333-0836","35730 East Montserrat Ln.","Lynchburg","MA","98844","Ukraine"
"5A42D55F-5466-4518-A08F-21002C7278E9","Jael","Nolan","xW pEziQVdLY","adipiscing ultricies accumsan malesuada condimentum turpis velit litora Maecenas Nulla feugiat amet","Hilda@Pellentesque.edu","8834059","10529849.06","11/8/2016 22:12:05","458-345-2055","33616  French Polynesia Ln.","Cudahy","TX","67395","Venezuela"
"3520E4F1-8D61-4B78-9DC2-4D643DA0FB3D","Chandler","Baldwin","jxnKt QIyWDz G","accumsan sapien luctus porttitor Etiam nec sapien habitant non","Arsenio@cursus.us","9791113","6730507.35","11/10/2016 15:03:31","255-884-5437","32074 West Christmas Island Ave.","Pullman","RI","89712","Finland"
"0421F1A4-9399-4063-BB11-E26A20F81029","Fleur","George","CC dVepFncsuSjX","nascetur Nulla nonummy rutrum accumsan ultricies sem Duis pulvinar lobortis pharetra lacus bibendum","Magee@tristique.gov","3175352","5805013.87","11/3/2016 10:07:59","446-749-5934","79075 East Kansas City St.","Indio","LA","73059","Falkland Islands (Malvinas)"
"D0EBC1B2-663A-432C-B1E4-68F54489EBB1","Conan","Olsen","FYmP FJTsif","arcu taciti Class hymenaeos mattis consectetuer Suspendisse nisi sodales luctus porttitor odio interdum mauris mi pharetra","Cade@commodo.gov","5105632","9271601.55","11/3/2016 1:09:06","385-623-8264","93056  Antigua and Barbuda St.","West Hollywood","IL","83831","Aruba"
"62359FB5-3E11-4A74-B71F-5A75FEEBE046","Keegan","Rivers","KvSuSgZkGtDZ","Pellentesque feugiat pellentesque orci risus Class nisi aliquam Cum Nullam sed parturient Cum ultrices rutrum","Vielka@felis.gov","929242","2763662.81","11/10/2016 7:01:26","005-091-3748","40844 East El Segundo Ave.","Egg Harbor","MO","03644","Serbia and Montenegro"
"28753C74-4AB3-4445-A185-1F5D399DE0DD","Hop","Chen","QvzjIaGx","senectus ullamcorper Fusce","Zeus@eleifend.edu","6786795","8573472.91","11/10/2016 21:34:15","742-824-9836","24368 East Bristol Ave.","Aguadilla","IN","03263","Tonga"
"57D4AD08-3F0C-496E-8A7D-6211D7C25143","Amaya","Wilson","HjIEtVQaIVWzvg","erat commodo felis dapibus vehicula lacus Lorem sapien leo ut ultrices vulputate auctor cursus ad a ut Class","Lars@nisi.edu","9792853","8987614.44","11/10/2016 0:58:33","635-187-1258","1094 North Douglas St.","Des Moines","MS","82506","French Southern Territories"
"452C6483-2B20-4C8B-AE01-106BE71EE6EC","Kelly","Trevino","RdYGg HEj","sodales","Rudyard@aliquam.gov","9928664","6514428.03","11/5/2016 18:25:00","762-067-4793","1368  Falkland Islands (Malvinas) Ct.","Pierre","NH","43913","India"
"D172330D-6B05-43C0-BF38-7A62F18A9640","Zane","Blackburn","WJfzJDIVUte","porta condimentum egestas sapien aliquam Proin aliquam tortor gravida mauris magnis malesuada Pellentesque sapien sollicitudin vehicula cursus senectus","Simon@mollis.edu","6552244","12450958.25","11/10/2016 18:20:24","547-012-8416","98006 South Belize Ave.","Madison","MT","28930","Tonga"
"2918EDE1-842A-4DC2-BC22-A3442962448D","Byron","Hayes","JazBEbtYdugQXfd","ante","Louis@ullamcorper.net","2889735","6426545.92","11/5/2016 4:58:16","326-922-4156","57824  Nicaragua Ave.","Fort Lauderdale","WV","66123","French Polynesia"
"E659BD7E-F1D8-4297-9CFA-5F8E928805AD","Mercedes","Stout","aIsCzVEZzTJQUN","pharetra aliquam venenatis mauris netus et","Mira@amet.org","9467152","15523273.45","11/6/2016 11:00:42","143-674-4000","90269 North Canton Ct.","Lake Charles","TN","38319","British Indian Ocean Territory"
"18F72F39-059A-471D-9223-46206AB2F47A","Dale","Castillo","darCzEcoTiago","blandit Lorem ac Phasellus vel sem","Jakeem@cursus.com","866168","14734036.63","11/8/2016 8:53:28","425-107-9250","79621 South Palm Springs Blvd.","Sitka","UT","63622","Philippines"
"FD349C8A-D047-4A80-A0AA-B4E823F283C3","Robert","Rodgers","lXIIANRTgqxV rh","hendrerit conubia Maecenas magna Mauris quam commodo nonummy vehicula","Heidi@Proin.org","4751969","14462600.69","11/6/2016 21:06:49","636-741-3795","66772 South Dodge City Blvd.","Orem","NH","68519","Guinea-bissau"
"42FDB82A-BF51-4F9C-B05C-BD1F189CDEE7","Priscilla","Baird","pWEfpIGL","nascetur fringilla Quisque tincidunt velit erat habitant senectus egestas neque","Holmes@morbi.gov","6143436","5353275.93","11/6/2016 10:12:02","891-457-5703","10975 South Bradford St.","La Cañada Flintridge","ME","71651","Thailand"
"677C37EC-5569-4D75-A9B7-19FBCCF0B50F","Nathan","Estrada","DPJDVszoAiWnq","nulla conubia sem auctor vulputate viverra erat arcu magnis Nunc ligula cursus","Guinevere@feugiat.edu","2754766","7773819.71","11/5/2016 20:34:54","011-160-2323","79805 West Lockport Ct.","Beaumont","FL","60235","Cook Islands"
"7316F17D-8746-421C-8C09-A2A0FF582B41","Chava","Jacobson","ktqvIVsFIlWzAP","placerat Donec","Mikayla@risus.edu","4500065","8269241.15","11/9/2016 0:27:03","944-408-6920","92376 West Fort Dodge Ln.","Lafayette","NJ","36732","Estonia"
"5F90CAE9-EDD5-42A1-8A6A-B2C31F8878DB","Galvin","Mcneil","XApBeBzKOGyax","primis Curae aliquet tellus in Proin vitae consectetuer rutrum netus per Aenean interdum dictum vulputate penatibus est sollicitudin elit","Brady@Vestibulum.net","3461326","12441506.97","11/5/2016 16:32:11","150-340-0492","26850 North Moscow Ave.","Guánica","VT","78320","Saint Kitts and Nevis"
"3DA548F0-CDF8-49E3-B0D6-9C2C9EFFB74D","Kenneth","Vincent","MfHGKOYr","senectus rutrum nibh tellus amet enim nisi est in consectetuer","Ila@est.us","157630","5103715.75","11/10/2016 0:26:03","436-572-4553","23476 East Kingsport Ln.","New Britain","NC","76786","Germany"
"D337B608-B541-48D2-93FC-EC9ACA1287CC","Maxwell","Mclaughlin","tNchuGywCHAU","laoreet scelerisque placerat condimentum Nulla pretium Nulla ullamcorper diam Cum mattis diam tellus nostra cubilia mauris Curabitur","Jason@elit.org","9604919","1328355.49","11/4/2016 19:06:31","551-110-8447","15260 West Haverhill Ln.","Fernley","WY","34161","Gibraltar"
"EB330945-466D-436E-B373-7F5FAE3B1634","Kelsey","Greer","pmGSrUgaf","hymenaeos felis augue imperdiet","Susan@Aliquam.gov","3320973","14122219.41","11/7/2016 20:37:49","877-665-6195","90822  Port Arthur St.","Waco","SC","90025","Bahrain"
"A7332694-E185-41D4-86E5-8C48ADF99A53","Sawyer","Wilkinson","bnYiTdhrOZTiy","Aliquam Mauris Phasellus","Wilma@taciti.gov","8384490","11122422.92","11/5/2016 1:15:06","514-742-9781","91538  Dodge City St.","Fullerton","KS","56400","Netherlands Antilles"
"7275EF82-9C58-4456-B872-3C7DC354BAC8","Kiona","Hyde"," VkaQIDnALsjeC","Proin nulla","Lester@arcu.org","7786581","5642957.96","11/10/2016 18:16:44","866-094-3402","79967 North Switzerland Ave.","Palmdale","SD","61350","Somalia"
"2B01F5D6-0696-4910-AC6C-71B79FF6676F","Mariko","Benton","rDcdpeLk","at Nam","Angelica@turpis.com","6250562","3516636.47","11/5/2016 12:48:58","154-900-8893","9883 West Argentina Way","Saint Louis","HI","58667","Sierra Leone"
"9E59585A-0634-4220-BE97-F65E46926B55","Tucker","Cole","eHwJHmzoW","vehicula dis amet nec facilisi Cras bibendum at","Calista@egestas.org","240953","6579533.75","11/10/2016 12:32:36","972-452-9062","75107  Clemson St.","Newark","NM","54963","Saint Helena"
"9EC473B7-5421-4CAD-A857-021E30BF0329","Dexter","Shaffer","zlGFhMfSCjuXyx","Maecenas","Camden@cubilia.net","3402890","7668826.42","11/6/2016 9:16:47","871-142-2804","32839 East Holy See (Vatican City State) Blvd.","Buffalo","SD","73822","British Indian Ocean Territory"
"120BE3BB-FF75-42C1-86FC-EF973A95591A","Basil","Mason","FEPCzbvATeBL","natoque fames viverra feugiat sapien In porttitor Fusce Nunc risus dolor Duis commodo dis est tortor massa Fusce","Rooney@Vestibulum.org","3927049","10029524.50","11/3/2016 10:20:53","547-878-9027","66007  Nicaragua Ct.","San Francisco","AK","23566","Tonga"
"23436AF8-569C-42B3-AF1F-C295E56B9128","Laura","Palmer","zNNbofZmAaa vd","Aliquam tristique Pellentesque mattis enim vehicula Ut cubilia Quisque eros diam orci Maecenas feugiat scelerisque","Berk@adipiscing.edu","581482","17131385.18","11/8/2016 20:07:59","545-481-3889","15441 North Cedar Rapids Way","Downey","SC","98272","Kiribati"
"623C78F1-2DE3-4EA7-839D-5801A749A805","Hanna","Allison","Z bNktRRhzwbHS","lacinia urna malesuada ullamcorper malesuada per Vivamus non tellus vel scelerisque dui Vivamus facilisi interdum litora dolor Curae nulla","Bernard@mus.edu","2950376","14006110.46","11/6/2016 23:11:23","987-916-2380","56103 North Des Moines Ct.","Del Rio","OR","73631","Palestinian Territory, Occupied"
"BDE996C1-E653-4033-9462-FAE4F7552EFD","Devin","Leon","jqZFsEhw","mus Nam hymenaeos sodales ipsum quis rhoncus blandit porta parturient nec","Aidan@a.edu","9426392","2550304.16","11/6/2016 2:43:53","817-119-3115","76004 East Saint Vincent and The Grenadines Blvd.","Holyoke","LA","37236","Tunisia"
"FE4CF741-33FD-407A-82C0-1B8EE547220E","Mariko","Mckee","BztHIuFlwB","id Morbi Pellentesque nunc vestibulum porttitor bibendum laoreet magna Duis","Colin@interdum.com","6398623","4729198.36","11/6/2016 1:21:12","223-529-0929","65971 East Norfolk Island Ct.","Akron","OK","98541","Croatia"
"DB6EF67F-567E-48A5-8F2F-05A186C55E8B","Charity","Poole","gWVPRSOOwFGaL","interdum urna dignissim pharetra dis Lorem justo rhoncus Duis tincidunt","Barry@eleifend.edu","4118971","9709700.34","11/10/2016 15:45:38","929-406-0011","86317 West Australia Way","Hornell","MD","40579","Grenada"
"CDBF20C2-6EF5-43BF-A5AA-52BBC995F842","Damon","Ray","rSDiNXACjaDn","auctor Quisque Cum auctor Class condimentum iaculis scelerisque felis fringilla natoque et","Perry@Etiam.gov","9570396","19352614.54","11/5/2016 19:55:35","408-238-7663","33719 North Dominican Republic Way","Plano","MN","53930","Solomon Islands"
"26BF9AB8-7E6A-406B-A219-E9C4CE41ADAD","Logan","Trujillo","UgkYjtzJZYs","leo torquent eros pretium fermentum condimentum eget malesuada Praesent venenatis vulputate Class Curae Aenean","Dale@aptent.org","1008227","4193421.86","11/5/2016 10:53:02","493-862-8411","48893 North Brunei Darussalam Way","Boulder","ID","73815","Cambodia"
"52983D7D-C7E2-4679-A781-61DF50FE4D1D","Palmer","Hensley","qECELhLno","sem","Jonah@pharetra.com","6766963","12558983.75","11/6/2016 15:06:48","680-179-4856","84981  French Southern Territories Ave.","La Puente","WV","50376","Saint Kitts and Nevis"
"CDADA025-E10D-4E3D-B625-977F4990354A","Nolan","Mays","xDxAltgelZE","lobortis bibendum In eu dolor auctor ac orci mus cursus metus Vestibulum Mauris","Hammett@tellus.net","191731","9832088.45","11/6/2016 9:18:41","221-869-7478","60451  Ashland Ave.","Plymouth","AK","90672","Aruba"
"3257FA0A-36E4-4FCA-B6B8-6B281B614594","Dolan","Cross","d ScxdKl","nostra mauris convallis non imperdiet volutpat leo molestie morbi inceptos Aliquam laoreet","Simon@leo.net","9220585","16901379.98","11/7/2016 9:21:01","481-441-4299","43627 East Trinidad and Tobago Blvd.","San Mateo","OH","93434","Bosnia and Herzegovina"
"5D8C8EC3-9D59-4F36-AF09-2283BF789BBD","Linda","Bryant","mIOcwuDq","Donec sit posuere vitae Vestibulum Sed Maecenas netus","Amelia@nonummy.gov","1059604","16271400.64","11/10/2016 7:59:26","316-402-4680","16128 East Uzbekistan Ct.","Pulaski","AK","46751","Bahrain"
"559DD96C-6F88-4A59-BD80-CC397B67D29B","Laith","Randolph","tspzBkWQk","pretium ut dignissim fringilla Pellentesque convallis nunc justo vel bibendum sagittis Suspendisse mauris","Aiko@dolor.us","4846431","16420837.39","11/8/2016 4:15:17","252-525-0446","84293 South Chula Vista St.","Jordan Valley","AL","03175","Macao"
"F6D20C37-CA33-4C32-A2C5-F218E1E07D68","Nerea","Burnett","IknPMfVJngm","Morbi facilisi est enim facilisi","Rashad@ut.gov","8526164","2546703.02","11/5/2016 1:40:03","679-149-4676","81833  Cook Islands Ave.","Morrison","MN","79341","Malaysia"
"219153D4-584C-4C14-8807-5A4F6894C76F","Teegan","Booth","iUXNcINoBRd","morbi placerat","Brody@accumsan.org","2410015","1326891.21","11/5/2016 9:43:39","183-865-5806","88101  Tanzania, United Republic of Ct.","La Crosse","DC","37809","Saint Kitts and Nevis"
"1E70468D-EB5E-49F7-8A53-4402D3455907","Cameran","Byrd","VVhpyNVNChMXi","sollicitudin et odio viverra Suspendisse Etiam","Slade@hymenaeos.gov","2510862","10453992.25","11/4/2016 12:36:19","010-552-4431","15487 South Niue Blvd.","Vincennes","DE","39030","Gabon"
"D800AA94-8236-47D4-AE89-7668E5335C1F","Germaine","Ray"," MsCrhCROXgImQW","tristique inceptos feugiat adipiscing Curae semper erat ullamcorper orci viverra inceptos felis leo","Abra@egestas.edu","9679859","17959759.15","11/4/2016 15:20:17","619-549-8605","57966 East Burundi Ln.","Anaconda","CT","17797","Nauru"
"EB9365C6-C6D3-4AB8-84A1-43220A655CFB","Hunter","Raymond","XgPupfppIzWr","Fusce faucibus ridiculus Nam aptent velit porta eu Cum litora Phasellus vulputate sit iaculis Proin","Axel@ornare.org","9557902","8913015.90","11/5/2016 10:46:27","578-228-0284","68201 South Hammond St.","New Rochelle","NC","47965","Dominica"
"DA294F31-EF3A-4B68-9C5D-F3F3782B34DB","Abraham","Miranda","VYzZdLdKMnjlUf","feugiat Lorem odio quam sodales sem taciti placerat felis","Carl@et.gov","4942765","3706249.14","11/4/2016 10:03:27","261-323-4735","17502  Burkina Faso Ct.","Phoenix","IN","58762","China"
"F0A5A823-349B-422B-BC52-8C8ECF0A4C2B","Uriel","Harris","JwIpEJkxlbb","odio sem mauris iaculis netus risus","Finn@lectus.gov","6981764","8402207.42","11/8/2016 13:06:41","381-132-2427","47191 West San Marino Ct.","Lexington","SD","95324","Paraguay"
"3DE8346E-7E62-4C11-9B92-0FD5291AC039","Joy","Kelley","cPmWHpfOFzj","neque enim eget lorem justo placerat sociosqu taciti euismod nulla lobortis tincidunt Praesent vehicula fames Suspendisse","Zenaida@Lorem.com","1448365","17276111.15","11/8/2016 3:48:54","197-661-7040","88153 East Guatemala Blvd.","Cranston","HI","67912","Ghana"
"4EF2082A-2AE3-4EE3-8189-3FEF5C594FD8","Hayden","Russo","cOJuEKTAfECXNP","nonummy per porta Suspendisse Vivamus interdum orci tellus pellentesque consectetuer Praesent ridiculus ultricies eget lacus malesuada vulputate","Macaulay@lacinia.net","576622","12992866.49","11/8/2016 22:38:43","837-540-6780","33924 North Chattanooga St.","Mason City","GA","32831","Wallis and Futuna"
"E0D81041-EDB2-4F0B-B030-72B153D26F31","Cameron","Guzman","WNjSFSEwcx","varius turpis vulputate aliquam torquent dolor ornare in hymenaeos urna Cras","Boris@dignissim.com","9165023","12187102.14","11/5/2016 23:28:29","199-086-2216","90343  Armenia Way","Galveston","TX","94662","Korea"
"EC3A794F-6EB5-4F35-9C52-55944FDEA0FB","Dora","Rivera","LAkuBBoawcUm","Integer rhoncus","Darryl@hymenaeos.gov","3186063","5177504.46","11/8/2016 19:06:24","175-619-2465","67097 North Cincinnati Ln.","Scottsbluff","VT","12147","Mauritius"
"0A9D2F15-15C8-4D7C-B158-D169CBE23F28","Josephine","Montoya","JyuGTpOlhw","odio Morbi condimentum semper amet bibendum auctor amet Etiam Curae Quisque consequat facilisis","Prescott@bibendum.com","372026","17912185.41","11/7/2016 11:08:52","489-133-3606","55908 South Cayman Islands Ln.","Saipan","PA","90847","Seychelles"
"E4DBE99C-C6E2-40CC-8F76-FE76B034FE63","Chadwick","Rice","ZMkaQVdKzHf","ullamcorper dignissim augue id neque ultrices Pellentesque eleifend sagittis Aenean id sociis diam magnis magnis luctus","Rhonda@ad.edu","5331608","441392.27","11/7/2016 15:52:57","530-255-1041","97398 North Thailand Ct.","Pass Christian","HI","33479","Uganda"
"1CAFFAD4-EE63-4234-86A9-8B2C9B8A3186","Oleg","Hartman","UkYsWcnoDLWI","montes elit malesuada lectus arcu mauris porttitor ipsum dis primis vel dis","Kasper@hymenaeos.us","5559267","4876128.30","11/8/2016 0:45:12","855-371-2258","63836  Liberia Ln.","City of Industry","MT","21966","Tanzania, United Republic of"
"F3EC9601-234F-4639-BB83-D51213EF1993","Perry","Conner","zWCPTyIgHu ","nisi hendrerit venenatis cubilia quis velit Praesent eleifend mauris elementum Vestibulum nisi molestie massa pharetra nibh pretium dui bibendum faucibus","Mannix@litora.gov","3518510","2834050.73","11/10/2016 11:58:00","731-615-0521","56379 South Nicaragua Ct.","Sierra Madre","AK","77435","Australia"
"619F9170-07AF-4705-91EC-65A2735B28C5","Simon","Nieves","dmlYbWMGzIPGQB","Aliquam neque libero Fusce Class vulputate per ligula elementum Nullam euismod mauris sagittis nisl Etiam natoque montes Mauris sem","Clayton@feugiat.com","3199782","14553971.21","11/3/2016 14:47:35","699-281-0281","7808 South Malawi St.","Brown Deer","NH","89903","Bouvet Island"
"CD3FF914-DCC9-4740-AAC0-B32BF0E88997","Maisie","Santana","HiaMmAejCqiPuIR","parturient Cum Vivamus lacinia cursus ante a ipsum Ut lectus Fusce","Mechelle@conubia.gov","4721362","10440417.62","11/7/2016 9:32:14","104-425-3178","23491 West South Georgia and The South Sandwich Islands Ct.","Winooski","ND","93247","Uzbekistan"
"5A514B2C-1F52-4DAB-BF27-04CB7ABA7883","Nissim","Pace","LZXvURZmge","Suspendisse risus hymenaeos nulla nisi lobortis ornare nascetur bibendum lorem","Raphael@Nullam.gov","5174856","9264349.95","11/10/2016 23:11:39","272-021-2953","93908 East Afghanistan Way","Hialeah","MO","10674","Maldives"
"D839F936-B157-4E8A-8EC8-D703125A1105","Cara","Pena","ptoAIgzn Gs","bibendum risus lacinia Cras lacinia montes Sed senectus risus","Kieran@ornare.edu","6899703","10980815.44","11/3/2016 23:19:29","861-361-2683","17888 East Belize Blvd.","Westfield","WA","01896","Maldives"
"C8BD9D61-3783-4F52-9545-2EE7DB1F0AE2","Cassady","Graves","SRwQcL orpF","mauris suscipit purus metus fermentum sollicitudin vulputate sociis congue lobortis conubia cursus sociis facilisi venenatis commodo laoreet","Dexter@est.org","8379082","4947944.41","11/5/2016 0:40:57","050-645-3564","65491 South Dominica Ct.","Scranton","GA","29449","Palestinian Territory, Occupied"
"0E0AE8F9-C772-43BA-B00F-786A351D6E7F","Wylie","Cain","kcBQKcyBjFDbPb","suscipit conubia nec metus ad blandit","Dahlia@eleifend.net","7161933","10188001.14","11/7/2016 12:17:43","658-083-5203","68186 South Mauritania Ct.","Lynn","NV","10462","Denmark"
"3336B7AF-B49B-474F-B56B-7B52B4D23F31","Adrienne","Jones","gqbNFDJLmYP","ante magna Duis dignissim leo ligula gravida erat mollis mauris turpis","Griffith@Maecenas.us","443297","5536098.37","11/10/2016 3:24:58","113-932-5691","27444 East Guatemala Ave.","Taylorsville","TX","35650","Somalia"
"D57BB074-F6C7-4988-9ECD-DB48F480B14C","Angela","Schmidt"," CUxfnwdUhNl","gravida Morbi facilisi laoreet purus lacinia fermentum nisl Etiam Quisque sed ac cursus suscipit dictum ligula Nam","Leah@dis.edu","6907139","13061430.88","11/10/2016 6:46:14","053-285-0695","82703 East Brigham City Ave.","Sunbury","TX","09996","Virgin Islands, British"
"AECE68A2-6A2E-445E-9194-594A1A8BF971","Kessie","Mclaughlin","sXjad oGUPxx","mattis pretium convallis placerat dui facilisis fringilla","Juliet@elementum.com","3488545","1573181.97","11/6/2016 15:58:32","088-626-9298","87021 North Fort Worth St.","Clemson","MS","18356","Samoa"
"7CEC4F4E-4B01-4149-B8B8-3FF50B383881","Mark","Glover","DNb hJnqhlFMLe ","suscipit diam dui nisl Pellentesque faucibus ultricies risus ut Cum Nullam litora","Karleigh@lobortis.gov","7232715","19101855.06","11/6/2016 14:42:53","274-993-4888","10770 South Costa Rica Ln.","Belleville","GA","82325","Palestinian Territory, Occupied"
"D2033049-CEC2-4FDC-AFC0-A6F98E72F55D","Stone","Hurst","NMpQ zxjQW w","pellentesque mauris sed dignissim Praesent Suspendisse congue ac turpis dolor Aliquam Maecenas sem accumsan est Cras Proin gravida iaculis","Bruno@pede.org","3462791","10592025.34","11/9/2016 5:04:49","477-084-6855","34459 South Lomita Ct.","International Falls","AK","03606","Cameroon"
"E0C5E362-0A13-4113-8EDE-EF6591A1AB4D","Marshall","Thomas","gjMP kSqDT","Curae fringilla tempus","Raja@varius.gov","8460935","8046975.58","11/7/2016 8:57:03","093-221-0544","47196 East Singapore Ave.","Athens","TN","02528","New Caledonia"
"FCF64F10-CD13-4CEF-9C2C-313F3F8C250B","Geoffrey","Shepherd","gcqjUiaeeEeHH","pretium cursus eleifend dis varius","Mason@eu.net","8298047","19214243.20","11/6/2016 10:05:01","836-595-6549","378  Cedar Falls St.","Hazleton","MT","15827","Kenya"
"FD3E0A45-BA78-49B8-9986-577B5BCA6BF3","Lyle","Burch","mlcLKTKUdcwC","aliquam nostra condimentum senectus vitae felis Nam eleifend ad ut Phasellus dis mi fames tortor In","Ora@Nam.gov","7423013","18966115.24","11/7/2016 2:54:33","170-465-3181","23566 East Malawi Way","Anchorage","KY","69728","Solomon Islands"
"830E2B8D-CD29-4B55-82C5-D97BB0788C80","Kameko","Willis","JGHKwXhebiRwkv","mi Fusce dictum magnis diam sociosqu mi","Lavinia@at.us","9651741","2759689.76","11/6/2016 2:43:48","912-096-3826","87271 East Cambodia Ln.","Catskill","NJ","59842","Reunion"
"66AF7E1D-A4F5-4903-AF1F-744FBB9A6E36","Halla","Mcgee","WGhfPNGsmO","sociosqu In","Slade@Nullam.edu","6163516","14301857.18","11/4/2016 21:55:22","171-580-4119","77144 West Delta Junction Ave.","New Kensington","MD","46651","Equatorial Guinea"
"9039259F-3383-44A6-9228-91DAAE001726","Hunter","Morin","wvsqLhasMvQm","placerat Nam vehicula sociosqu Phasellus","Yasir@risus.us","8487622","14736788.89","11/7/2016 16:06:56","697-292-8243","83196 East Wallis and Futuna Blvd.","Flint","AZ","02756","Seychelles"
"05875148-389F-4587-8190-B1915D835360","Blaze","Abbott","YpJGwB wAlqlLOa","Curabitur libero pellentesque auctor dolor eu varius diam feugiat risus Quisque","Conan@tortor.gov","4413440","8844901.20","11/9/2016 7:32:08","311-605-4380","53943 South Palestinian Territory, Occupied St.","San Clemente","ND","83518","Argentina"
"F91D4871-80AB-4972-A179-60443FE72ABF","Ferris","Barker","Lkjo XotnmTi","vel tristique ante cubilia dui blandit orci tellus elementum ad dapibus lobortis Class magnis","Ryan@Fusce.gov","4245788","17517958.75","11/5/2016 13:36:35","993-265-4807","41751 East Antigua and Barbuda St.","New Brunswick","NV","96045","Argentina"
"C8241FCA-4D8C-4703-8102-E1FD53177A94","Iris","Davidson","QIwVPGXJZvI","Morbi mollis leo diam Cum nibh Maecenas primis adipiscing orci litora scelerisque nisi Vestibulum euismod","Zelda@justo.com","1205251","10419013.55","11/10/2016 3:11:24","433-036-8012","67503 North Hayward Ave.","Fairfax","OK","62472","Paraguay"
"5DA1B053-9E1A-4A34-836E-5E897F0F4F70","Garrison","Bailey","LOLmtRougiW","vitae accumsan at vestibulum turpis nisi bibendum sagittis augue massa id ipsum luctus","Katelyn@odio.net","9557513","3380575.18","11/5/2016 0:26:14","824-633-2739","97231 South El Salvador Ave.","Kalamazoo","NM","70976","Viet Nam"
"61ABAFE4-7CCD-40DA-B193-76D616BF21D4","Tanner","Ramirez","EhjxwT RW","aptent Class tincidunt auctor lacinia Proin Maecenas Cum elit justo nibh Suspendisse mattis dignissim Etiam erat","Trevor@justo.net","1593870","7622977.15","11/5/2016 11:52:45","971-724-2938","4423 South Littleton Ct.","Montgomery","NJ","23907","Seychelles"
"9A7F909F-394D-40A3-B01F-D642C1D782BF","Abel","Ford","YkgOdZckKNavmnl","conubia","Kelly@velit.us","8888705","10908423.22","11/5/2016 13:35:46","300-081-1963","28275  Angola Ct.","Dover","KS","72853","Costa Rica"
"A2328C90-0768-46EA-9AEA-D41EC1F929B3","Ivor","Murphy","hNZgAjkSNugWFG","porttitor luctus","Wayne@viverra.org","8879707","8876970.76","11/5/2016 11:09:42","057-227-6412","22915 West Maldives Ave.","Cicero","AK","55415","Gambia"
"ED7406B0-E457-488A-AC5B-697C52561FC1","Stuart","Rasmussen","UCiOuIGyOiy w","bibendum cubilia augue ligula posuere eros consectetuer felis vestibulum accumsan Aenean nisi sociis","Alan@vehicula.net","7873069","19085415.62","11/4/2016 6:22:45","566-240-5809","4479 North Samoa Ln.","Del Rio","CT","07250","Sao Tome and Principe"
"539EAC3D-B253-4E88-8821-EF9AA7AE13A1","Blaze","Noel","yRcPcwBEypjh E","augue tristique placerat Curabitur scelerisque vitae","Samantha@fringilla.us","3312606","3756893.03","11/10/2016 11:28:45","855-426-9193","24798 West Tajikistan Ln.","Dothan","MD","79058","Japan"
"E68025CF-80B0-4AA7-8745-764A4CDD9148","Ignacia","Conley","SJprywEOhWnWFIk","litora dis lorem tempus","Kellie@cursus.us","2263191","9918117.18","11/8/2016 17:46:02","872-590-0528","18737 South Paraguay Way","Wisconsin Dells","OH","37183","Kazakhstan"
"DCDBBED9-5CA2-482E-81D5-1B1E08E118BF","Alyssa","Travis","cbpfMZHOm","metus aliquet viverra ante","Yeo@commodo.edu","2583952","7163382.87","11/7/2016 18:49:49","836-555-7870","80988  Cameroon Blvd.","Yuma","OK","97810","Angola"
"95C44C0F-DC25-41D7-863D-90576EFB492C","Devin","Fry","XoRy GIPbaS","tempus nascetur eu porttitor ipsum quam bibendum quis elit venenatis Vivamus erat ipsum volutpat","Prescott@dolor.gov","8900463","4267092.27","11/7/2016 11:18:32","395-319-6988","35774 North Burkina Faso St.","Hamilton","MT","93395","Honduras"
