ID,FirstName,LastName,Type,FreeFormText,Email,Integers,Reals,DateTime,PhoneNumber,Street,City,State,Zip,Country
"8C7C2BD0-C81D-4261-AE3B-0D04EAAF6E9D","Nomlanga","Farrell","ntEhgocVzJbUMYw","est felis habitant lacinia Vestibulum elit Nam arcu malesuada Proin cubilia nibh volutpat Morbi","Alden@tempor.gov","1735313","6954583.88","11/7/2016 11:34:18","078-509-3991","1446  Norway Ct.","Portland","AZ","45454","Eritrea"
"B8BF3C03-2699-4735-9FAE-D7C9B479A8CA","Jeremy","Reed","pMAvLSfQjJh","scelerisque eros sapien bibendum ultricies facilisis tempus erat ipsum massa Curabitur Phasellus pede elit ultrices Etiam sollicitudin","Lucian@netus.net","9541583","11712347.46","11/6/2016 9:20:52","816-332-4106","33948 North Chad Ct.","Rock Springs","DC","34888","Nigeria"
"EFC96161-252A-4B57-9094-AEDE42118FD7","Orli","Charles","iOhfh qexqmIc","conubia iaculis nisl","Karen@malesuada.us","134007","16600447.91","11/9/2016 13:26:03","328-885-3924","25950  Moorhead Blvd.","Montgomery","NE","52000","Antarctica"
"42FE38F9-21FD-4072-AE8B-B14B9055DF17","Clio","Mccarty","GprtiRbz","ridiculus elementum libero suscipit aliquam rutrum","Cassandra@porta.net","7076014","3735025.92","11/6/2016 10:12:02","676-796-2364","73751 North Somalia Ave.","Thiensville","AL","72425","Venezuela"
"85C8AA0C-10B7-4BC2-A7D3-3A9B0EE60FC8","Xena","Mclaughlin","Lcaf QJp","enim facilisi magnis magna pede lorem rhoncus tempus","Hu@hendrerit.us","8155869","11334855.33","11/8/2016 15:02:47","825-519-4813","775 East Guyana St.","Racine","MO","62830","Reunion"
"B03B6786-AB5D-402B-8FC6-B9560B3546AC","Karen","Watson","slEZRP pKNeW","Integer lacus nostra molestie","Zoe@gravida.gov","4861981","18542373.66","11/4/2016 23:27:20","107-752-6130","28988 West Angola Ln.","San Juan Capistrano","WV","75924","French Polynesia"
"853E765E-E2E2-4D13-A8A1-19FA56B23DDC","Brett","Ortiz","gkAeGRWZemglhIE","Integer lacinia cubilia nostra suscipit","Rhiannon@a.edu","5709024","8557547.80","11/3/2016 10:38:16","862-081-2432","28343  Marshall Islands Ave.","Appleton","MO","30520","Argentina"
"5B69FA8F-B13A-480D-832E-14772C0A512D","Oscar","Moran","sgwAGPxdm","luctus augue dis metus neque vitae pulvinar consectetuer vulputate eu Cum magnis nisi enim euismod pellentesque Duis","Jerome@netus.org","8071519","12614085.50","11/9/2016 0:44:26","772-451-2982","20976 North Tokelau Ct.","Starkville","TX","27033","Philippines"
"CA2C3D4E-4EBE-4A39-B750-11F912DCE7A7","Zahir","Howe","vUvTtXpfI","libero condimentum","Jescie@sapien.us","4203568","9967351.63","11/9/2016 4:01:06","087-694-6140","83935 East France Ln.","Waukegan","KY","94654","Liberia"
"30F1FBC4-F813-40DE-920D-1B64A54C23C9","Zeus","Britt","YQctsWFd","suscipit pede cursus felis tincidunt eleifend","Jaden@taciti.us","6921345","4904985.74","11/4/2016 2:02:57","650-173-6380","48744 West Canton Ave.","Union City","MD","49492","Bolivia"
"E49796BA-6ED4-4279-969C-FA3D212A0B98","Cooper","Bolton","UZrvwDSIu","commodo facilisi netus","Ralph@montes.org","2683454","789277.21","11/9/2016 22:49:48","497-057-9926","42485 North Saint Lucia Ave.","Asbury Park","VA","58226","Qatar"
"6CC1A7E9-D8B1-45C3-AB98-7711CD253E76","Abraham","Mcgee","QhEl cKfPvd Tux","odio Phasellus venenatis Proin","Regan@Mauris.gov","2629989","4383907.38","11/4/2016 16:00:47","912-591-6184","5531 East Russian Federation Blvd.","Mequon","OK","60804","Burkina Faso"
"F7918EE7-ADDF-400F-8F2D-D0E634BA22C7","Wyatt","Colon","fNG FONMK  N","Aenean In varius sociosqu porta varius fermentum nibh","Mia@ac.edu","5582542","8012509.91","11/5/2016 15:10:08","076-474-1048","32293  Barbados Blvd.","Poughkeepsie","AL","34906","Armenia"
"85E7D8D0-87F6-4B6A-8978-0828AA505194","Oleg","Estes","LWnYNdFxuLvL","feugiat Sed leo eros malesuada natoque sollicitudin sed gravida netus eget lorem Aliquam mollis eu montes augue Duis Nunc","Keane@lobortis.edu","6189660","10058561.25","11/6/2016 11:39:28","418-581-4991","14329 West Central African Republic Ct.","Hattiesburg","OR","24636","Saint Lucia"
"9B6164B9-3FF6-4D42-96AB-FE17FEDB2189","Aimee","Taylor","DfjaFv ddRZG","dapibus eleifend consequat non urna Quisque","Madeson@dolor.net","6891218","7232167.25","11/6/2016 9:22:23","612-331-8856","82863 West Burundi Ln.","Fajardo","PA","37741","Turks and Caicos Islands"
"D93085D3-C6BB-4957-8471-AE147257F440","Keane","Mullins","IDHbUPilyQ","hendrerit cursus Cum varius suscipit mi Nulla varius mi purus ornare placerat non","Hamish@elit.edu","8694682","14911193.28","11/8/2016 4:21:33","165-305-2379","14006 East Ghana Ct.","Atwater","KY","49605","Korea, Republic of"
"FAE00EAC-C6F5-4DF5-918A-9DCEE3009069","Travis","Barlow","sbcExJVL","Etiam non Lorem malesuada et sodales Vivamus quam faucibus viverra Aenean nostra Nullam adipiscing odio eget","Armando@per.org","3504765","12144292.47","11/10/2016 14:48:33","372-180-0798","90248 East Moraga St.","Mobile","MS","79310","Norway"
"6C51F21A-9734-478A-813D-CB3040CA9AD3","Kylie","Mclaughlin","cOOSnLHt","tincidunt euismod Nulla odio sapien mi luctus bibendum erat Fusce Vivamus nunc mi vitae id sed cursus nisl","Caldwell@quis.org","8760180","2150272.15","11/6/2016 12:30:46","654-660-2394","67945 East Belgium Blvd.","La Puente","WI","16091","Anguilla"
"F37F6A26-4547-4A5A-BC7C-7DF3230E4AEE","Margaret","Greer","VjlvHkFBJKW","Ut luctus Mauris volutpat habitant ipsum tincidunt Phasellus","Acton@rhoncus.gov","6529499","15196162.55","11/7/2016 2:25:23","620-226-1583","2625 North Swaziland Blvd.","Santa Barbara","ME","77851","Ecuador"
"046E4266-0ED2-47DC-9CD8-7EBEBC44FDB9","Ryder","Espinoza","vQuvaGDapWAO","risus ut quam laoreet dis vestibulum elementum nulla gravida Pellentesque Quisque morbi congue fames","Mira@interdum.org","3438341","7676500.79","11/4/2016 13:08:20","594-986-2249","58435 East South Georgia and The South Sandwich Islands Blvd.","Saratoga Springs","HI","49864","Virgin Islands, U.S."
"E4139E86-B086-4AF1-9BAA-3F18C0D62AAA","Austin","Joseph","EOhxDAcvv","Duis fermentum Suspendisse neque","Willa@tellus.gov","6643680","3094213.38","11/9/2016 0:27:31","539-075-4231","18147  Lebanon Ct.","Champaign","CO","89300","Peru"
"55DBEA7A-F36E-497D-AF6A-F75FA110E7F9","Denton","Miller","VLwrWQWotek","faucibus nec varius venenatis aliquam","Prescott@dis.org","2854106","12096703.74","11/3/2016 23:37:21","501-995-7185","68066  Kiribati St.","Port St. Lucie","MT","73375","Sudan"
"4449093E-BB97-433B-8A6B-BA1A152268DC","Wayne","Todd","fegBrpXrqD","sollicitudin ornare suscipit sociosqu hendrerit sollicitudin feugiat amet","Chancellor@nibh.net","9628254","7031472.53","11/4/2016 4:45:09","710-206-0649","54368 West Anguilla Ave.","Greensburg","AK","47582","Egypt"
"49050CAD-108A-4559-9A24-EDF6FF6B89C5","Paloma","Curry","aZOf BHPRD","Etiam Curabitur est sit Donec aliquam id Class vulputate senectus Quisque varius montes ligula inceptos ipsum varius","Phillip@risus.org","1429493","3420920.23","11/6/2016 21:59:00","763-253-3312","90400  Belize Way","Palm Springs","MN","47359","Jordan"
"2ABFACAD-A939-447B-85A7-23E6DF9294A4","Clementine","Munoz","lvwviKnAHEFVif","sodales mi tortor euismod per taciti pretium ad massa Donec Cum elit","Alyssa@Donec.gov","5962518","3263974.45","11/4/2016 10:10:49","585-545-2728","83450 West Japan St.","Littleton","AK","10444","Aruba"
"A030ADE3-8301-4418-AC96-023B1D75E4D2","Shannon","Baldwin","HHUYNLhu","nisi molestie urna tortor Donec ornare diam odio primis odio","Timothy@ullamcorper.edu","6153539","6603689.68","11/5/2016 5:18:58","243-002-6876","52655  Bethany Ct.","Saint Paul","GA","34806","South Georgia and The South Sandwich Islands"
"842C120F-C418-47C3-926F-012322F6E5D5","Briar","Snider","qZzbuSC poqqwhd","montes senectus lectus sapien eros Nullam tincidunt sodales pretium porta Class Duis","Maris@montes.net","203829","9333511.29","11/8/2016 1:47:26","052-019-7558","41532 East Sudan Blvd.","Vernon","MN","85551","Malta"
"A8497FE0-12C9-489D-B2C8-797B74122EFA","Reagan","Cummings","SkZSewudqEPjM","nascetur elementum vel suscipit nulla non varius natoque hymenaeos in","Kenyon@accumsan.edu","3397421","7925318.03","11/5/2016 19:34:14","540-926-0737","82428 East Burbank Ave.","Dover","HI","42895","Somalia"
"60F3A713-BD36-4DAF-B755-9FD23F587AC0","Rosalyn","Delaney","zWrkLSTl vScXaN","varius venenatis bibendum et Maecenas bibendum","Flavia@mus.gov","4408031","4610885.60","11/9/2016 22:13:31","785-977-6212","47208  Cambodia Blvd.","Cape Girardeau","MS","07004","Montserrat"
"2C84DCC0-881B-4832-8B6F-883FFD81D244","Charles","Hendrix","ZMRWQOsOo","tortor varius semper","Peter@senectus.gov","7711558","12933016.06","11/3/2016 7:16:07","333-208-6370","88142 South Niue Ct.","Kennewick","CA","85964","Antarctica"
"A41F77EE-1BB3-425F-ABDE-6C532A6E1A63","Patricia","Keller","RhDuQpsfvgU","libero Fusce tortor commodo neque dapibus","Bernard@fermentum.edu","3795003","15292384.28","11/9/2016 17:51:13","642-934-4436","85722 South Huntington Park Ln.","Egg Harbor","RI","50726","Lithuania"
"976FFDC6-E62F-412B-8207-26B3F3653B6B","Joan","Pratt","AnbZwEKOyYdqBf","Nulla lorem odio nibh enim Vivamus sociosqu non hendrerit sed","Ira@at.org","4791821","7375171.41","11/10/2016 14:44:13","951-058-9449","71583  Pittsburgh Ln.","Nacogdoches","AK","33960","Slovenia"
"8887FA19-9326-47AC-B96B-610C47D26A16","Cameran","Barrett","mSlVzuKnfGGCs","ullamcorper facilisi at non volutpat adipiscing vel","Karleigh@sapien.us","5380847","11470531.06","11/6/2016 17:47:23","336-496-5889","59319 South Ghana Ln.","Hackensack","NE","15906","Dominican Republic"
"D38A8AE0-2D13-41FC-8D3B-2651B5414770","Magee","Molina","PCHHxzgNphWmlOh","Maecenas eros viverra diam tincidunt ultricies augue blandit nulla lacus tellus dapibus Phasellus","Kareem@quam.com","6346803","5393327.05","11/3/2016 14:54:51","785-512-2636","24605 North Saint Pierre and Miquelon Blvd.","Texas City","ID","37748","Lesotho"
"77A95557-E26C-4422-B94A-D47ADC80BED0","Kadeem","Blackwell","OHZbAxejmu","parturient rutrum feugiat luctus","John@pede.gov","5547890","2852112.19","11/9/2016 13:44:01","884-362-5037","92572 North Merizo Ave.","San Gabriel","LA","95783","Sri Lanka"
"C84F4100-5BA7-4FD8-866E-E35A4BD96A0E","Debra","Montgomery","NzOlVPfqveRPkRO","nascetur tortor euismod gravida felis molestie ad","Keith@Cras.org","206216","4082.51","11/6/2016 3:55:51","430-169-0079","31007  Ann Arbor Ln.","Elsmere","NE","72749","Zimbabwe"
"F7046639-19AC-4F1C-86E2-555A844BBBE0","Rhonda","Robles","WYkFczve","malesuada ultrices id inceptos facilisis mi Aliquam Suspendisse scelerisque aliquam ullamcorper mattis Class Lorem eros sodales rhoncus","Holly@fringilla.net","4205433","10905562.63","11/3/2016 2:34:24","889-537-2005","83819 East Iran, Islamic Republic of St.","Youngstown","WA","28591","Gibraltar"
"90E6D9F9-A433-4544-AC8D-D3911B9A5C71","Steven","Ingram","XAcdqhEy","vel nunc quis magna pede nec laoreet vestibulum aptent Phasellus nostra felis Mauris congue Fusce mauris ultricies gravida","Pascale@natoque.us","9958300","2539390.89","11/5/2016 15:35:24","508-689-4166","16037  Kankakee Ln.","Radford","ID","50479","Niger"
"1A8F2E2E-EB88-42FC-8F66-1D46AEFF279A","Darrel","Alvarez","lJbRljkAUUlQ","morbi sodales elit pharetra eleifend sagittis Proin fermentum rhoncus vehicula Proin sociis magna mollis faucibus magnis est","Ciaran@luctus.com","1008004","17893450.03","11/5/2016 12:51:53","597-720-9418","34865 South Highland Park St.","Ontario","AK","76134","Ukraine"
"FE86973D-502B-4487-AEC4-CB2C522C042C","Ezra","Blankenship","WCvGjONW","eu a Suspendisse","Gisela@Vestibulum.gov","9036135","16979612.54","11/3/2016 7:10:03","575-415-8445","98437 North Nogales Ct.","Walnut","VT","59981","Martinique"
"44B7A2FD-9710-4BC3-BD1C-BF97A1FA3568","Tobias","Allen","tZlNtFgPsZ","venenatis Proin Pellentesque In placerat parturient sit Integer sollicitudin ultricies conubia sem risus Sed Phasellus faucibus orci","Willa@varius.us","420428","11807589.52","11/9/2016 3:27:36","573-034-4183","49147 East Brazil Way","Indianapolis","DC","01587","Saint Helena"
"468610B1-CE2B-4765-89FB-3D2E3198EA90","Ayanna","Petersen","qIGeRJQJjhB","Donec inceptos Integer at litora montes rutrum fames cursus Phasellus hendrerit dapibus ullamcorper Integer lobortis quis adipiscing per eleifend Nunc","Kareem@natoque.gov","5688699","14523457.07","11/10/2016 16:09:10","074-040-2538","27234 South Puerto Rico Blvd.","Clarksville","NM","69482","Bosnia and Herzegovina"
"3D38F5E6-E864-48C6-9601-A6ED797FA439","Kelsey","Dickerson","xmFymVJQdDtwIdJ","Integer neque Nullam vestibulum sapien Etiam parturient nascetur aliquam Nunc sociosqu turpis libero tempus at facilisi massa aptent convallis","Shea@vestibulum.net","6878317","18033027.79","11/5/2016 22:22:49","530-830-0984","54270 North Chad St.","Oneonta","GA","42759","Swaziland"
"FE08F993-4903-436A-8D46-18FDDA127324","Teegan","Frederick"," GIBXZqZwR sz","erat rhoncus sem ornare nostra Nulla dignissim parturient mattis molestie fermentum parturient cursus vestibulum accumsan fames suscipit condimentum libero","Amity@sit.net","4265946","6219846.46","11/10/2016 21:16:08","914-015-3898","6169 West Slovenia Blvd.","Moscow","RI","36779","Bouvet Island"
"7979F020-6C57-4000-B8A2-99B40A4E54EF","Todd","Duffy","XRYXIsKCZshNFyx","tempor bibendum Mauris lorem nostra Mauris volutpat lobortis justo eleifend elit arcu ullamcorper luctus ut netus vestibulum scelerisque pretium","Vielka@vulputate.com","6313533","17722879.41","11/7/2016 23:29:06","569-025-9236","8241 South Slovakia Ave.","Miami Gardens","VT","03018","Norfolk Island"
"3A561FA0-F91A-4AF9-B87D-E28B7B41AA43","Brenden","Shepard"," GtetDdwgwieoUe","porta aptent urna semper venenatis sodales quam Nunc velit volutpat Sed magna Lorem tempor aliquet pretium sit Nam Proin","August@cubilia.net","9067027","2345904.44","11/8/2016 18:10:53","114-269-5356","10806 North Goose Creek Way","Las Cruces","CO","55234","Tunisia"
"81E4A2FC-4728-4597-93A0-8A3A5712FFE7","Dahlia","Wolfe","nnDqhRqK","auctor aptent porta senectus inceptos","Gary@felis.us","9410660","3194340.71","11/5/2016 12:27:01","718-275-9540","4006 North China Blvd.","Hannibal","PA","64019","Palau"
"13536C5F-C28C-4DCF-8C39-A80DFA7BCA52","Sydney","Callahan","iGojmMAVCoQR","in malesuada cubilia tempor aliquet pretium posuere In leo auctor","Fay@natoque.net","3903251","11711734.37","11/7/2016 11:55:27","272-916-2424","53873 West Syrian Arab Republic Ct.","Nevada City","AK","20834","Gibraltar"
"155B0AC1-600D-4FD3-92BA-74AB757FD0D3","Philip","Norman","INYj arsTZC","sem porttitor Vivamus dui","Sybill@tortor.gov","1755069","4985234.36","11/5/2016 8:22:00","621-963-9845","65734 North Bulgaria St.","Belleville","CT","17835","Morocco"
"69C97C5A-DD69-45F2-A3BE-44780F413F97","Darius","West","zqEAHENJJGKp","eros tristique","Helen@eget.gov","3936666","15949727.45","11/3/2016 0:00:51","887-542-9895","34263  Saint Helena St.","La Verne","OR","84140","Algeria"
"D772E5E5-2D7B-4FD2-87A1-C298B1BDDE6B","Mari","Stephens","HvWnYOkCsT","primis facilisis urna ad nulla facilisis lectus penatibus vel ultricies vulputate","Jessica@dictum.com","8325654","10171170.81","11/8/2016 16:52:06","419-454-5147","37398 East Germany Way","Nacogdoches","RI","77488","Taiwan, Province of China"
"C71904BB-8BF0-4CD1-B050-7E051CF76F57","Bianca","Aguilar","EHIaoKHWS","Class lorem eget est Pellentesque rutrum sociis pretium nonummy natoque eget Nulla ultrices amet Integer Nullam lorem Sed","Aretha@pharetra.us","7774020","15416137.23","11/4/2016 12:40:12","011-845-0910","4324 East Iceland Way","Cohoes","LA","79417","Botswana"
"25954BCF-487D-4939-83F9-E3B4CA052F28","Geoffrey","Saunders","qzmTdgRd","fringilla montes tellus morbi metus dis litora eleifend venenatis Vestibulum lorem","Macaulay@sociosqu.com","5273101","6115012.71","11/8/2016 11:54:48","891-942-2260","85168 South Dominica St.","Sister Bay","DC","70937","Cook Islands"
"1405A8F1-DD11-40CE-B8D3-D1825C6864FC","Fiona","Austin","KqfvQLBxwVGz","Nulla ipsum sociosqu Vivamus purus Nam parturient arcu consequat egestas hymenaeos ornare Phasellus varius ornare lacinia iaculis nulla odio nisl","Branden@Vivamus.gov","2082519","13383108.27","11/5/2016 5:27:50","110-443-9398","39400 North Beloit Ln.","West Sacramento","NV","00317","Sudan"
"C9868674-173B-40AE-85AD-144642245AED","Mari","Weber","rxvFdBOu","cubilia Phasellus facilisis euismod conubia sodales gravida","Christen@Maecenas.com","8031952","1534580.77","11/10/2016 5:56:27","216-602-9576","19594  Iran, Islamic Republic of Ave.","Steubenville","MD","19089","Maldives"
"78FFB351-FEEE-4785-B90A-44B788B1E949","Anthony","Sharp","uFuDmnseftvTPv","sociosqu diam suscipit molestie","Aaron@taciti.com","3602669","11046867.51","11/4/2016 15:38:18","627-239-8165","1757 East Bahrain Ln.","Passaic","WV","98515","Hong Kong"
"364C192C-6987-4C86-825B-F1875B37186E","Brock","Dominguez","IoPuhdQZ","nisl cursus consectetuer Cum morbi hendrerit dignissim metus quam amet tincidunt porttitor congue orci feugiat ullamcorper accumsan","Giselle@accumsan.us","2083704","15914886.92","11/4/2016 4:01:27","444-731-7369","77343 East Indonesia Way","Thomasville","VA","91045","Chad"
"A17BCF7D-1656-4A96-9F7F-BE363AEE1602","Ingrid","Ellison","DNfOSMlwpDY","convallis ornare Lorem hendrerit eget mauris venenatis ac est tempus pulvinar torquent condimentum Vivamus Curae","Mallory@at.com","4922614","7275441.21","11/4/2016 13:32:34","882-609-8907","53538 East Eatontown Ln.","Rehoboth Beach","IN","11922","Gabon"
"523C0276-593B-418E-A4B7-8792031A4A71","Bernard","Rios","kvbgjPmb KIjjWa","Curae Nam nisl facilisi mi sed quam netus placerat arcu Lorem suscipit Vivamus ligula Quisque","Chester@venenatis.gov","7894528","12200119.26","11/6/2016 13:20:31","036-274-1972","28926  Serbia and Montenegro Ln.","Naperville","OK","00615","Ukraine"
"327BEFB6-F19C-4CF5-9C97-6C99891C5CFC","Ursa","Maldonado","NoOpmxKYMGiF","nulla aliquam Fusce augue parturient accumsan inceptos vulputate leo molestie conubia","Rigel@Curae.net","5308764","7258848.98","11/8/2016 8:22:16","966-600-0086","51852 North Russian Federation Blvd.","Turlock","MO","18922","Virgin Islands, U.S."
"95C01508-8480-472D-8F42-B6DA07097CD4","Raven","Grant","DZddgPTCX","imperdiet commodo volutpat justo aliquet vel velit congue placerat Proin Duis Suspendisse massa senectus convallis consequat","Josiah@velit.com","8534436","3583162.50","11/4/2016 3:08:16","168-341-9189","92240  Central African Republic Ln.","Portsmouth","TN","57840","Bahamas"
"877188B3-FB19-4B0C-AF4B-1F7DFB9C513B","Lacey","Mcfadden","rkklXUyVIpYfKM","porttitor iaculis","Jonas@Duis.org","9588642","6889868.93","11/10/2016 22:15:36","646-234-7002","79043 South Aruba Ave.","Peru","MN","70778","Belarus"
"DE14343D-F9DE-4A49-BC9E-CB88B6F1F1E2","Lavinia","Richardson","cMPmJtRJe","neque","Lillith@enim.gov","7370571","18888373.32","11/8/2016 18:17:17","594-661-1779","84184 West Northern Mariana Islands Way","Beacon","NH","69785","Mexico"
"C8F29AE3-B8B2-4F5A-A18E-0C25BFAFFFBB","Olivia","Goff","RXuXWdKoFaCL","nascetur Quisque pellentesque erat","Brian@bibendum.net","4540744","16746364.11","11/6/2016 6:29:51","513-168-0916","89911 South Murfreesboro Blvd.","Oklahoma City","MN","46547","Nigeria"
"629C3DB8-74E7-4A40-8445-88788448715B","Dorothy","Underwood","iptorgachaqlEf","et Ut semper sem nonummy leo condimentum purus lacus In Proin orci","Harrison@Aliquam.net","9644183","1257821.50","11/9/2016 0:04:43","927-766-0797","52570 South Little Falls Ct.","Stanton","DC","20431","Mauritius"
"F118DB9C-BF9B-4C8E-8C2C-DC776FFB5392","Stone","Kent","XVplLUoCe","primis Fusce ad pede in Curae nostra nisl parturient Integer lorem Aliquam semper semper","Lacy@nunc.net","3317118","13248892.84","11/7/2016 5:43:19","541-819-1174","61637  Sudan Ave.","Monterey","VA","74558","Swaziland"
"7B778AAB-FF34-436A-8A98-5CD29DB2AA38","Buffy","Tillman","bV sANHYKbuSNK","pede","Rowan@cubilia.com","2864760","17860917.41","11/6/2016 21:59:21","733-616-2850","61829  Chicago Blvd.","Isle of Palms","NV","14110","Marshall Islands"
"245B3F27-E075-4EFE-A293-3A368D94EA96","Macaulay","Patterson","qFpxUpjkkOuYgM","vestibulum Cras parturient Lorem orci volutpat venenatis pulvinar enim","Elmo@scelerisque.edu","8451668","6551428.11","11/6/2016 20:37:57","493-561-1119","2880 North Papua New Guinea Ave.","Aspen","MN","92654","Monaco"
"26C1260B-A032-4B63-9524-2AD8543021DB","Reuben","Conley","KJJdSkSXREhoBcp","mauris nascetur primis","Abbot@vulputate.us","4452884","4993223.06","11/3/2016 21:36:29","473-664-8500","49493 West Fairfax Ct.","Waco","WY","22483","Bulgaria"
"C8E91D45-CA96-48F6-8DEF-52B1F7BB6616","Fay","Todd","OAFAJkDRPuYHt","auctor fringilla Cras primis commodo ridiculus neque sit","Cameron@tempus.gov","8977016","15539486.65","11/6/2016 8:11:17","517-534-9237","56323 East Belarus Way","San Juan Capistrano","IN","72004","Wallis and Futuna"
"396BF27C-85A3-459F-9047-D948399B9EBE","Violet","Barron","kzNTDbIQX xpqD ","suscipit Lorem rutrum imperdiet","Steven@vestibulum.net","4498760","7767314.87","11/8/2016 14:14:53","196-449-3173","94402  Portugal Ct.","San Clemente","ME","45295","Moldova"
"FAB497E8-9564-4176-BF71-E8795A98ABAB","Avye","Herman"," dmeDhyyGlQP","Nullam orci pede nisi Aenean Vestibulum lobortis metus litora purus est eleifend mollis","Raphael@nibh.gov","3375600","12735719.38","11/7/2016 10:54:21","654-977-5236","43742 East Hong Kong St.","Weymouth","NY","52980","Norfolk Island"
"9603B601-4B5B-4DFE-9C00-0022AC348613","Jordan","Newman","skWYZTuxTysfXG","euismod laoreet pede parturient vehicula varius parturient suscipit ligula Class consequat lacus molestie rhoncus posuere accumsan litora posuere porta Aenean","Scott@sollicitudin.gov","5672909","7044302.33","11/9/2016 0:19:15","154-039-8709","54571 North Lithuania Blvd.","Oneonta","NE","06569","Senegal"
"5379C3B2-975D-48AD-BB46-1D95910A4D87","Caesar","Solis","kTJsYiMMkaWD","lorem lectus ipsum lobortis Sed Nullam ornare","Nathaniel@tellus.us","391729","14383886.08","11/7/2016 0:00:47","559-749-0230","2840 West Newton St.","Scottsdale","MN","30144","Eritrea"
"B23089E2-2218-49E9-98AA-DC322CBD909E","Xavier","Moody","YzdfMgQSAZj","adipiscing nunc dictum Nam dui luctus pharetra","Tamara@Fusce.us","8175920","7987569.47","11/5/2016 20:25:51","889-761-3528","3836 North Taiwan, Province of China St.","Vancouver","OH","59144","Kenya"
"DBA4480E-2A46-4348-AC63-2174E40CC023","Galena","Watson","DKptbPhiQ","gravida laoreet pede ornare Suspendisse lacus","Jemima@accumsan.edu","5349872","11516539.79","11/9/2016 21:33:22","160-069-5447","85546 East Brooklyn Park Ave.","Anaheim","WY","44559","Uganda"
"0D239B7D-0B0B-4C8F-BDD3-6BEADBB1AF49","Amanda","Miller","uLATgtQUz","sagittis cubilia purus Duis tortor congue pulvinar inceptos cubilia elit Maecenas In lorem fames Nulla Lorem augue tristique","Malik@bibendum.com","7494109","17746500.48","11/4/2016 20:22:30","005-427-9288","45572 South Hartland Blvd.","Holyoke","ND","04825","Belgium"
"62233219-6070-4CDA-828F-8FC5BF8DC0B9","Otto","Vaughn","wvgIOtfCndadzG","Pellentesque lacinia natoque lacinia velit Nunc felis In Proin","Quinn@at.org","785965","7630556.81","11/3/2016 13:35:17","757-519-3691","39506 West Flint Ave.","Omaha","UT","76867","Korea"
"C21F9E54-313A-4F2B-B9C8-32B5FEB966C2","Lyle","Maxwell","MsRIYUtNEFi","justo velit pellentesque torquent aliquam laoreet lacus eros scelerisque scelerisque hymenaeos in venenatis ultrices porttitor vitae","September@risus.com","4505991","6458971.18","11/4/2016 3:48:29","162-734-4254","37153  Guinea St.","Cicero","TX","30032","Virgin Islands, U.S."
"616FD238-1BD1-48BA-B527-6E096B05D844","Todd","Powell","COkAdPnlFljnt","nonummy facilisis faucibus montes Cras elementum venenatis Nunc","Zachery@vitae.us","9540183","8607472.45","11/10/2016 23:45:32","039-212-6633","12260 East Puerto Rico Ln.","Columbus","HI","40759","Luxembourg"
"0C5983DE-9272-427F-9251-A245D7210EBD","Irene","Delacruz","TOdWkCwNbvHenG","commodo fringilla quam sapien Class dis","Austin@malesuada.gov","7482939","12645582.43","11/3/2016 15:11:20","028-957-6305","55779 North New Albany St.","Pascagoula","AL","34336","Philippines"
"A8F5AA81-176E-409B-847C-0700A615AC9B","Neville","Davenport","EWoUOxqapaDa","natoque sollicitudin est in lacinia Integer ullamcorper mollis Nullam hendrerit tincidunt viverra vestibulum","Leroy@Integer.edu","4839967","15370931.68","11/10/2016 15:34:37","879-768-7200","74585 East Bosnia and Herzegovina Ln.","Liberal","WY","81841","Haiti"
"6D45AAAB-87E0-4294-9F3F-37E9F12C540A","Kermit","Reeves","VrBhJqKg","ante Vivamus cursus litora pharetra sed Class nulla libero elit consectetuer","Nerea@dignissim.org","7323717","18913323.51","11/7/2016 3:46:59","887-516-2472","65115 North Eatontown Ln.","Easthampton","IA","45057","Tajikistan"
"929E1FCC-12C3-49F5-9C9D-17611C154D52","Dante","Pacheco","sVpKrEknwuE","Fusce enim tincidunt Fusce mollis Vivamus Donec luctus dapibus nunc commodo justo mattis odio malesuada","Hyacinth@habitant.us","3442646","19083100.55","11/9/2016 18:28:35","537-988-1604","27876 North Andorra Ave.","Decatur","MD","92151","Russian Federation"
"6E76839E-DF23-4BE6-B907-8FA2AEE6E4A1","Audra","Kramer","coCGdRSMph","tristique enim amet tortor Mauris","Tashya@auctor.net","5848029","1231607.56","11/9/2016 10:01:56","596-842-5309","87324 West Hannibal St.","Jacksonville","MA","73521","Qatar"
"20ECC87C-A96B-451C-8062-531590A2A29D","Alyssa","Banks","xyfPXUdQHwlo","tempor nunc magna gravida","Lamar@massa.com","7342904","8811937.58","11/6/2016 7:41:35","777-919-2013","31947 East Grenada Blvd.","Corpus Christi","NM","97087","Brunei Darussalam"
"3235C67D-D0BC-4A75-8A03-52DD37AF6C95","Mia","Gordon","a HKrEypoByIGoO","netus risus pellentesque interdum","Sonya@aliquam.org","3271792","11542888.61","11/5/2016 16:21:36","878-461-6916","49031 West Brooklyn Park Way","Williamsport","KS","94050","Canada"
"7E1ECEF2-61E7-4D32-ADB8-573B2829199F","Regan","Haley","SadkUTvYfLoO","non fames taciti magna pharetra quam Fusce rutrum lacus mattis Duis vehicula","Garrett@senectus.org","7845044","17082536.47","11/6/2016 12:12:12","118-245-5538","47668 East Azerbaijan Ct.","Oshkosh","TN","51344","Lithuania"
