ID,FirstName,LastName,Type,FreeFormText,Email,Integers,Reals,DateTime,PhoneNumber,Street,City,State,Zip,Country
"C388CA8A-1A6A-476D-B5AA-9B6ABAC70A0D","Sean","Wade","SF LBfJJRGqeF","Morbi ullamcorper Nunc rhoncus pretium ridiculus Ut vel pulvinar ad magnis est Suspendisse tempus Class elit ipsum Maecenas vehicula Pellentesque","Renee@porttitor.gov","8958657","13497701.67","11/7/2016 6:57:47","179-702-0729","83296 South Belize Ave.","Omaha","ND","37916","Israel"
"254CE9D9-48E0-4F06-B54A-8183FDB5951E","Dennis","Atkinson","TBvKelmPZBMLqZr","placerat Fusce rutrum Pellentesque id Suspendisse mauris torquent tempus Nam","Macon@blandit.us","6632119","12363861.23","11/9/2016 11:48:00","203-764-7045","93461 South Palos Verdes Estates Ln.","Klamath Falls","ND","21048","Lithuania"
"D8D82CEA-AEE8-4EA5-919C-267A8225AAB7","Aspen","Emerson","oMgaUIQBDPCA","nascetur Nunc aliquam","Ina@magna.org","8333807","19736914.35","11/6/2016 10:22:23","753-751-1698","91985 West Highland Park Ln.","La Verne","LA","26566","Colombia"
"D1526A9A-89B2-47CE-B939-45B875B60BA4","Lester","Deleon","NjyOPXRWDPsDdU","Aliquam sed tempor Class semper mi tincidunt sed penatibus eros","Camilla@nibh.org","5558353","16872484.80","11/4/2016 10:31:00","274-766-0763","74252 West Australia Ct.","Seaford","UT","82458","Togo"
"2492EA43-D62B-48FC-93E5-06CA4A4E23B0","Theodore","Booth","xbULjsXgGREoF","cubilia ultrices pharetra odio et iaculis In imperdiet Vivamus Donec pretium facilisi nostra Quisque Duis","Lucas@tortor.us","6467931","3468073.20","11/7/2016 12:13:27","921-630-5329","43204  Hong Kong Ave.","Turlock","ND","45817","Tonga"
"8671F8B0-0BFC-4C47-AA19-BA5BA160F482","Madaline","Atkinson","zJMiVUymYqm","nec sit diam nonummy eros taciti Fusce dapibus sagittis viverra","Ann@Curabitur.us","7808279","7512636.52","11/4/2016 1:13:30","335-884-7063","46055  Iceland Ct.","El Monte","WV","55794","Puerto Rico"
"9F1E07E1-F24A-45C9-A5F6-A978E94BC2F4","Joshua","White","IHrvyUDHc","dui sollicitudin eu Curae suscipit auctor habitant tempus et sapien","Medge@tempus.net","2515181","17097717.67","11/7/2016 14:32:45","406-901-8996","62733 West Mauritius Ln.","St. Marys","AK","71032","Saint Helena"
"539E163C-83DF-462F-B026-32FA91010081","Shaeleigh","Graham","YDGMnrKoQizxck","dis Praesent semper","Denton@vitae.org","375324","11344271.47","11/8/2016 0:41:25","405-625-1178","54774 West Fredericksburg Way","Shelton","WV","25115","Guam"
"49090C7F-C35F-4BD3-976F-7423B936F4FD","William","Best","AyQdPwhSVUJO","porttitor lectus turpis magnis eu lorem","Freya@ullamcorper.net","2620403","12662535.97","11/10/2016 3:16:57","317-367-6008","7106 North Gibraltar Ln.","Cairo","OH","81208","Peru"
"E40DC5A9-3429-440F-975D-68F0D46EF73E","Halla","Kaufman","wxqVQfyRbh","rutrum Ut","Gareth@euismod.gov","491677","13842645.07","11/8/2016 15:05:52","628-992-9769","5362 South Kenya Blvd.","Laguna Niguel","ND","82649","Liberia"
"37F4DBD9-A017-4947-BD44-6C048D15F6F0","Vladimir","Dixon","TPghrIdh","malesuada fermentum diam Cras mus taciti erat diam dis Donec Integer condimentum nostra fames molestie tellus odio turpis","Rooney@augue.gov","7282382","19217282.76","11/8/2016 14:02:31","787-728-7662","96858 South Djibouti Way","Lufkin","MI","06130","Bahamas"
"CA2BD8C0-E564-4999-9595-AB3D50FC88B6","Lyle","Richards","jAJccfpdbXgbadS","Cum elit quam commodo rutrum fermentum rhoncus","Hammett@primis.edu","4581021","6376905.83","11/5/2016 6:12:15","627-975-1405","86667 North Gambia St.","Keene","ND","56876","Belarus"
"810C8F4D-75D6-4327-BA4B-4C6B7E542EF6","Hilel","Powers","OgbjeHPKogmGDn","mattis risus in Fusce per vel","Reagan@Class.net","9210959","18811532.80","11/7/2016 1:37:00","213-181-7061","2230  Uruguay Ave.","St. George","IA","57224","Ukraine"
"4EAB0EBB-DE01-4195-92CD-104807F1EFA3","Lavinia","Watts","tsUTfHbdUTA","sed Proin ridiculus tellus ad et euismod feugiat vestibulum Ut habitant tortor pede Nullam","Kasper@Class.net","3851248","17472054.64","11/4/2016 1:13:15","479-423-8639","24193 North Macedonia Ln.","Natchitoches","ND","75235","Suriname"
"7DEFF4EF-05F7-4E32-961F-93388ACAA982","Kasimir","Key","RZslwpIN","sapien Vestibulum magna suscipit Maecenas consequat pellentesque condimentum dignissim massa pellentesque sit aptent vestibulum pretium Praesent urna","Chandler@dignissim.gov","9590669","18311385.62","11/7/2016 21:57:27","193-889-6329","74920 East Ames Ct.","Sandpoint","OK","50434","Monaco"
"6F6C4009-B55E-40F4-A212-32CDF9C63C59","Troy","Davenport","zNICwVpDbbP","natoque enim viverra mollis ligula turpis porttitor semper molestie ligula quam Duis enim tempor Quisque lectus taciti Vivamus","Graham@dictum.com","9441019","19019187.35","11/9/2016 3:51:36","729-253-6958","37439 North Latvia Ln.","Rhinelander","RI","12361","Equatorial Guinea"
"6061B145-1C1A-462F-BAAF-60CE609D59A3","Vaughan","Farmer","QZVoglbnCJ","rutrum","Hannah@torquent.net","7552977","12590567.64","11/10/2016 20:28:09","116-556-0667","79468 North Korea, Republic of Ave.","Brownsville","KY","65503","Zambia"
"56308F14-4C67-4E73-A247-DE90BA3ED148","Melinda","King","fUsKsYZeYNLa","vitae facilisis adipiscing pretium aptent nascetur Cras ante ultrices Ut fames faucibus","Graiden@lectus.org","6220153","13224315.45","11/5/2016 12:01:13","458-921-4590","49265 West Cudahy Ln.","Scranton","MT","54416","Cuba"
"CF6196F6-B6E7-4C16-91CF-BFF565DD5220","MacKensie","Newman","WtuuuIbfkxthRDt","fames parturient montes Cras non quam Nullam vel parturient Nam","Sopoline@sociis.edu","2783268","10812474.89","11/9/2016 16:09:26","313-055-9762","60076 North Netherlands Antilles Ave.","Shelton","ND","39023","Samoa"
"40FD9E33-9B65-4934-8C82-BA9FAF55BE8A","Cairo","Hobbs","HsvmffzO","Maecenas sit sem libero rutrum Lorem varius parturient Morbi hendrerit blandit adipiscing Nunc nulla tellus primis","Eleanor@fermentum.org","3902813","17836029.87","11/6/2016 13:19:48","844-008-9274","63335 North Gold Beach Ln.","Little Rock","IN","15273","Samoa"
"B12A99B7-A1EF-4646-8076-86C845156B3D","Rooney","Hodge","aQcCZAqIc","ullamcorper penatibus placerat bibendum consequat metus montes","Kyle@eu.us","4761674","14462337.01","11/7/2016 4:38:49","571-208-7475","2524 West Niue Ave.","Salinas","AK","51658","Kiribati"
"7E34D081-ADA2-4D83-AE29-CB2DDAC9F1CB","Dale","Anthony","OuPRjVix","primis volutpat mollis Maecenas ullamcorper Nam Cum pede netus ante suscipit nunc","Patricia@senectus.gov","9416584","11373556.37","11/6/2016 23:20:18","988-777-8169","56151 North Costa Rica Way","Inglewood","MS","58419","Bosnia and Herzegovina"
"77671E50-2724-4261-AC2A-D9BF0CDB7C7D","Wylie","Estes","FmilwJNTSP roc","fermentum viverra aptent","Melyssa@sapien.gov","5763025","16546504.18","11/9/2016 9:30:50","879-960-3532","43832 North Gambia St.","Binghamton","LA","81094","Bahrain"
"57BFD017-0005-4FD3-A23F-F5DD8DAAC51E","Paula","Maddox","XSRJKPGIuw","magnis Suspendisse sed eget erat","Dillon@blandit.org","7782057","3586817.40","11/10/2016 3:11:17","743-467-0322","23280 West Djibouti Blvd.","Clarksburg","WI","32548","United Kingdom"
"8B45293C-5161-40EC-B8A9-2E4F31A751A4","Thaddeus","Chapman","AyfCrZiMIg","Nullam fames fames Aenean Morbi mi eros","Chelsea@hymenaeos.org","8581641","10819254.14","11/3/2016 20:30:17","194-269-9577","23985 North Austria Blvd.","Ontario","CA","36751","Cambodia"
"79EF6828-6E5B-4748-AE10-7CE53C6D452D","Bianca","Clarke","fPmCvxMvOb","rutrum magna aptent","Timothy@penatibus.net","7205145","18792015.25","11/5/2016 3:28:21","001-322-5110","97097 West Senegal Ct.","Frederiksted","NM","19516","Lebanon"
"6485BF67-BD12-4682-ABA3-289F6A4A4914","Tad","Hess","eOxngrTUqyS","pretium pellentesque lectus porta eleifend dis velit Curabitur tempor nostra pede Nulla tempor Maecenas Sed mattis","Troy@placerat.edu","5351966","19602434.70","11/4/2016 0:24:04","958-145-1522","94020 West Venezuela Way","Dayton","IN","26091","Poland"
"F49A88CD-F8F2-497A-9D88-5976DAA84330","Adria","Cameron","N IohqgqNZFh","aptent tristique tortor at hymenaeos nibh nonummy aptent venenatis est consequat lacinia rhoncus Phasellus pulvinar arcu sapien feugiat","Ciaran@laoreet.org","8832583","425591.97","11/5/2016 0:47:01","991-114-9256","88622 South Mali Ln.","Newburyport","AK","80779","Grenada"
"AD2C17DA-7E44-487E-9B12-C3A41476822B","Blossom","Duncan","GLiYCAqHh","est blandit fermentum augue porttitor laoreet Curabitur faucibus Nunc","Imelda@Sed.org","3953132","15162393.79","11/10/2016 22:10:29","626-968-8978","69548 North French Polynesia Blvd.","Quincy","MI","04428","Kenya"
"BE69CA9E-EE5C-4B74-ACAA-89EFA60E2E2C","Catherine","Ewing","YeRMKwflwCftz","per placerat a hendrerit","Leroy@augue.edu","4738457","5608878.04","11/3/2016 6:31:31","757-896-4397","95504 West Panama Ln.","Sheridan","WY","10787","Fiji"
"4E2691CF-9185-4D65-A115-D037357D55F7","Craig","Jordan","VBctrSZeyJXlt","metus Cras urna consectetuer pharetra ultrices Nam fringilla neque erat tincidunt montes faucibus nunc","Katell@luctus.edu","4976760","9725404.26","11/8/2016 8:38:44","688-818-6960","96685 East Cedar Rapids St.","Cairo","AK","42155","Syrian Arab Republic"
"7B6D9848-6F2F-4CA7-B2C8-4CC45668DA49","Quemby","Stanley","lVoNcCmeZiuIPWb","morbi Nunc Sed lorem auctor faucibus consequat sit sit urna est urna","Oliver@conubia.gov","7317019","12618350.30","11/4/2016 2:40:15","187-745-5851","19112 East Yemen Ct.","Kenosha","CO","93631","Mexico"
"C85110DB-1521-49D1-A7AC-2EFD59501C68","Kieran","Curry","hnSqXcjYSn","Nunc ornare morbi Ut Duis Fusce sociis sodales torquent hendrerit congue sodales nostra justo","Xanthus@augue.gov","119642","13158541.76","11/8/2016 12:56:43","288-990-1288","43199  United Kingdom St.","Redding","RI","22002","Cyprus"
"EF4FAC8B-45DB-4CC3-B70A-639D6604400E","Angela","Oneal","IvQcLrmAhUKQTOI","tincidunt posuere nibh placerat nonummy sem cursus eros","Jermaine@non.edu","4142476","16141828.88","11/7/2016 23:01:29","823-374-2714","65797 South New Castle St.","Cicero","AL","52145","Iceland"
"FAA9F0BC-F32F-49FB-8DF5-01B4ED0DCE2C","Abigail","Byrd","AuSwM VVSxUwz","pellentesque consectetuer tempus In","Coby@netus.gov","8246892","6964431.40","11/5/2016 6:41:13","076-991-6518","30322  Germany Ave.","Ontario","SD","58250","Timor-leste"
"741C905B-2010-4C3F-8723-D560193A2A7E","Tamara","Stark","iXggKpHe","sapien nibh fermentum aliquam a viverra faucibus nec sollicitudin nunc nascetur vitae","Stacy@tellus.edu","2429791","5921353.63","11/3/2016 12:06:52","940-590-3602","8496 South Egypt Blvd.","Lahaina","TX","71786","Burundi"
"B1323787-4FDE-41A9-AABE-F2CC9727074A","Zelda","Perkins","XMIPhTARM","nec venenatis dictum placerat pharetra non Cum Vivamus vulputate ultrices","Jasper@imperdiet.gov","1213723","16204701.69","11/6/2016 6:44:07","864-971-2532","53418 West Philadelphia Way","Effingham","AZ","02320","Niger"
"29849B1A-1941-4205-A197-C17F9EC75CFE","Ezra","Pugh","kNgsQMjfK","mus sagittis elit aliquam","Yetta@Vestibulum.net","1788072","13624726.75","11/4/2016 12:51:02","522-806-2303","75567 West Trinidad and Tobago Blvd.","Juneau","MN","00196","Macedonia"
"9869DBB0-CB24-4061-839F-C94CB3AE5ED6","Octavia","Carpenter","KCibGvkpEvEPI","dictum torquent Cum eu natoque orci sollicitudin id gravida habitant dignissim sodales lobortis mauris eros iaculis viverra congue Morbi","Neve@In.us","6558955","18622038.63","11/8/2016 20:06:54","688-871-0942","50272 South Grand Forks Ln.","Portland","NY","48154","Malaysia"
"79EF30B4-6AAC-41E9-B975-8DBD23A69DA4","Rajah","Schultz","Lwly cuEsphqg","Nullam eros ante tincidunt odio nulla penatibus egestas Nunc nibh Nullam augue parturient dapibus semper ante dictum lacinia dolor","Baxter@lacus.us","2004603","8478326.38","11/7/2016 19:09:06","983-105-5020","89199 East Dunkirk Ln.","Vail","AZ","30771","Guatemala"
"5851768A-601A-4E93-A092-C0D4047CCE8F","Noelani","Head","OPAboczHgXr","turpis ipsum penatibus senectus magna hendrerit dolor inceptos fermentum odio Vivamus Curabitur suscipit ultrices aliquam massa","Harper@enim.com","5465374","7626334.21","11/6/2016 23:01:51","444-099-5874","24703  Ecuador Way","Lawrenceville","CA","45570","Mozambique"
"BB44892E-BE03-4E3F-8087-9771C2605756","Keefe","Parks","pDbcYFyMloECi","scelerisque sem Praesent aptent","Helen@netus.com","783796","2202077.41","11/5/2016 18:56:25","927-756-6490","81776 East Comoros Ave.","Bethany","IN","56541","Ghana"
"14B9E8C4-EBC5-4CEB-99EF-E062AA1253D4","Carol","Mcgowan","xuVCoo b","tortor molestie pellentesque bibendum et netus","Brady@mi.net","7798832","11501857.06","11/8/2016 12:52:52","769-209-6556","73570 North Samoa Ave.","Gastonia","AZ","38917","Slovenia"
"473543B1-6FBC-4B86-AF3F-3ABD8DEFC5EB","Anthony","Dunn","rRjmaawjwBQq","quam consequat dolor sed nonummy","Ava@pede.edu","5100699","12670407.27","11/8/2016 9:58:10","045-623-9336","4717  Somalia Way","Brockton","VT","54074","French Southern Territories"
"244B396C-7EB9-4570-AAF5-4A87047F6A0D","Yardley","Porter","GiQBadOx","scelerisque bibendum scelerisque consectetuer nec gravida lorem leo accumsan","Darius@leo.org","1647013","4688596.17","11/3/2016 6:09:51","168-433-2496","9077 West Croatia Ave.","Derby","OK","88943","Viet Nam"
"20A6BB91-E19A-4862-A79E-45281B8C3FD2","India","Shannon","oSJdzbSKjWG","senectus Cum nec Fusce mattis Sed libero","Malik@magna.org","3435924","18853819.03","11/9/2016 1:23:39","339-483-2457","94720 North Fitchburg St.","Laredo","WV","09248","Palestinian Territory, Occupied"
"6A8BF700-0B12-49DE-9A84-B10774A4CB1A","Illana","Chaney","EkUQzBfhmLzsooo","ante neque dignissim Sed euismod placerat felis amet urna fringilla Cras fames pretium eros","Charde@neque.gov","9561095","11682459.91","11/6/2016 14:19:46","370-891-9436","35483 North Bolivia Ct.","Coos Bay","NH","62951","Comoros"
"A61A94ED-DDFC-4413-8436-2E81970BD6A9","Wayne","Holman","Dgsy RCGk","nibh quis congue egestas facilisis non bibendum","Griffin@Nulla.net","3318280","11688911.34","11/4/2016 5:52:36","347-469-5335","60752 North Christmas Island St.","Arvada","NY","89264","Namibia"
"B7BCFD62-5A50-4B95-8D27-3D5DBC02D77B","Neville","Rowe","nKpuzASjQEN","tincidunt parturient Curae Curabitur fames Vivamus viverra massa sodales tempor dis magnis neque litora orci consequat fringilla in","Uriah@ad.us","1140330","5581394.26","11/10/2016 19:39:56","597-718-5715","73375  Gary Ln.","Corona","NE","88788","Western Sahara"
"95701F7B-6726-4C7D-9CF7-5BE72472D148","Nola","Baird","fJlNIlFM","risus conubia Integer Nullam diam sociosqu ultrices erat aliquam accumsan In mauris tellus mi adipiscing parturient natoque dui","Stephen@mollis.edu","8474748","9752901.01","11/7/2016 13:11:39","658-734-6292","73338 South Saint Pierre and Miquelon Ct.","Worland","AK","07772","Kazakhstan"
"91559626-FB85-42EB-82A1-C7B7DA779B2F","Leo","Stanley","TeHgVIyl","Vivamus Donec Praesent blandit cursus Proin ultricies conubia accumsan felis lobortis torquent ad","Indira@dolor.net","1313165","17492814.38","11/5/2016 19:50:16","514-483-3827","65266 South Caguas St.","Fort Dodge","ME","01312","Micronesia"
"58E6098F-747E-489A-8F70-017E6B7AAA8E","Allegra","Sykes","qbXShOCkZHAK","ante venenatis velit tempor placerat volutpat placerat tellus quis arcu non facilisis pharetra vulputate vulputate molestie quam ac libero litora","Merrill@elementum.org","7219130","13638674.94","11/9/2016 7:45:52","473-602-0948","25508 North Chile Ln.","Hamilton","WV","20594","Rwanda"
"78A742F8-08AA-4171-A696-486C71862C15","May","Mclaughlin","AeqKbaWfyaXpYn","tellus metus egestas mauris Vestibulum sollicitudin Nam at volutpat eu senectus sed erat dui hendrerit fermentum elit","Harlan@pretium.com","8024547","10340849.52","11/8/2016 16:25:05","788-941-4412","94914  Akron Ln.","Clearwater","AZ","53256","Costa Rica"
"EE9783D0-0B55-406A-835E-3351FD8B0D55","Jameson","Bowers","eeyyYPwZMHAlqN","orci aliquet adipiscing lacus vitae massa magna massa","Idona@luctus.us","6177647","5748700.40","11/3/2016 19:20:01","409-943-6567","10873 South Comoros Way","Des Moines","OK","24155","New Zealand"
"D6A46D98-E230-413C-AEC3-148E683E4107","Athena","Marks","SZZuoJWcmj Cpb","Class risus luctus ornare ultrices Integer sit at aliquam euismod lacinia Lorem leo libero neque tristique Morbi","Fiona@diam.com","3556287","927404.50","11/3/2016 8:59:29","009-317-8360","67656 West Namibia Ave.","Douglas","AZ","47389","Northern Mariana Islands"
"0405D5B6-409A-4B8C-B98E-99AA7D2B4328","Dolan","Guerra","DfFbbJHjZVt","mus vitae Phasellus velit dis nec vitae hymenaeos adipiscing","Hector@tellus.org","4894107","5350975.68","11/9/2016 8:20:19","145-787-8083","32274 East Farmer City Ln.","Honolulu","DE","49962","Djibouti"
"FA1EBEBE-56E6-474A-8A01-C96F04483C20","Blythe","Olson","GTKsTTpfgy mZjy","arcu Suspendisse sed eros torquent lorem vitae tellus mus montes dis elit","Brian@Vivamus.us","2750481","15998988.75","11/6/2016 21:27:45","440-088-4828","26785 North Central African Republic St.","Edmond","IA","43993","Paraguay"
"88A4E4F0-DE09-4B36-B332-081DC5D92726","Allistair","Gallegos","JdrvOhTjOZ","parturient elementum lectus elit diam Lorem rutrum mus","Bert@ac.org","9302419","13401918.19","11/10/2016 8:44:22","189-341-3426","35929 North Eufaula Ct.","Odessa","WV","89713","Mali"
"0E8AA124-78AC-4D77-8B3D-B076DA6ED562","Kadeem","Clemons","dATcMJQ xfhZ","Quisque venenatis dictum orci augue","Selma@magnis.net","2133529","11034004.37","11/9/2016 5:33:43","238-243-4169","26893 West French Guiana St.","East Hartford","TX","14766","Anguilla"
"C063EFF0-BEB1-4CD4-9B5A-9455FC0B1D42","Chastity","Goodwin","mAhBXORmKjkf","sem sociosqu id hendrerit mauris In Fusce quis sed diam lacus tincidunt","Raphael@Curabitur.net","6078896","19795476.70","11/8/2016 10:03:35","201-952-0376","23126 East Japan Ct.","Thibodaux","CO","90994","Armenia"
"FFF7F77C-362F-4C2B-AE79-EF2B57AB94DB","Sara","Brennan","MuJFMBZP","Etiam dolor","Bethany@blandit.gov","4473054","3609362.00","11/6/2016 19:58:56","383-885-7297","13331 South Lubbock Way","Latrobe","NV","03810","Italy"
"A3F931A0-1FFD-419B-81E0-35B1841B168E","Lars","Pierce","SDImNEusuFoZLu","augue Suspendisse amet Nunc elit tristique iaculis Vivamus erat In semper id Nunc","Gemma@urna.com","8444557","16736843.22","11/4/2016 5:27:11","485-942-1561","43095  Benin Way","Sonoma","AK","67728","Bulgaria"
"44C4F1A4-71DE-40E6-BBD2-BCFB5FB86AA6","Judith","Shelton","ICyohAPYz","mauris dictum senectus Aenean metus In Nunc Phasellus mauris Aliquam iaculis pellentesque pede elit","Idola@tempor.gov","4398744","11973765.06","11/8/2016 18:13:18","368-291-9178","1408  Panama Way","Coral Springs","AL","17771","United Arab Emirates"
"A29FF438-E88C-46B8-BDAF-FD07B94FB5DE","Elton","Garrett","SRfcclhLNHHWI","ultricies Suspendisse ante leo Donec ultricies enim feugiat venenatis Nam","Dominique@rhoncus.net","7620156","13281593.76","11/5/2016 11:24:04","324-511-0691","95940 South Norfolk Island Ct.","Huntsville","NC","46327","Japan"
"49B18E16-39B3-43E9-BD92-66D615D4F2C8","Aidan","Bailey","fpHZVIIJSE","vehicula vulputate torquent Nulla Nunc luctus amet hymenaeos augue lacinia condimentum mattis in Nunc ut rutrum odio varius ipsum mus","Athena@fermentum.us","4033655","14111572.78","11/8/2016 3:06:10","872-042-2574","85087 West Guam Way","Walnut","KS","15931","Grenada"
"07906F22-7331-4997-A51C-A15949FBFA85","Grant","Melton","wBgdJTJkQql","ante ultrices aptent Vestibulum facilisi diam ligula purus eget nonummy orci sem Donec euismod In","Alea@blandit.edu","6007126","485635.65","11/9/2016 5:51:54","011-749-8869","73993 West Luxembourg Way","Annapolis","ME","90843","Trinidad and Tobago"
"CEDF7B06-0ECA-4A86-9C58-D369F5E63615","Orson","Cash","tkCGZSpyU","primis nibh luctus Mauris et mollis consequat dolor iaculis vel tempus","Rina@scelerisque.com","2603658","4885153.28","11/5/2016 3:08:45","060-514-8508","8121  Bhutan Ln.","Ontario","AK","48003","Suriname"
"711DD288-75FA-4B34-B999-D69C0FB492DD","Timothy","Chaney","ontixiRCXaZ","nonummy bibendum Curae mollis accumsan morbi Donec eros Sed odio nisi lectus","Cooper@auctor.com","95526","8773296.14","11/5/2016 4:35:05","062-053-4089","47611 East Armenia Way","West Hollywood","VT","21800","Macao"
"832393F5-D255-42F4-BA60-6E7C4945BAF5","Colby","Taylor","kbBMRCVHZD","nisi neque pretium montes netus volutpat iaculis justo","Asher@leo.edu","3127529","17138952.46","11/5/2016 10:03:29","092-285-1331","65924 North Central African Republic St.","Monterey Park","DE","27937","Portugal"
"623F3221-7A45-49ED-8B75-2B606BBD994D","Nelle","Sykes","OqUnQEMsY","condimentum semper Nullam enim ridiculus a Phasellus porttitor quis Nunc nunc dolor Phasellus eleifend neque Quisque odio viverra porta suscipit","Beck@pharetra.us","5673745","16608888.64","11/7/2016 23:19:12","172-420-8587","99124 South Carson City St.","Keene","VA","78139","Eritrea"
"C7F7FCDC-4600-4F09-ABB1-497639A4C8E1","Fulton","Mann","eOLZffTGanPxMVn","sociis luctus pharetra velit sodales","Jakeem@arcu.org","8123169","5572866.18","11/6/2016 12:08:36","702-222-1325","88660 West Antigua and Barbuda Ln.","Easthampton","IA","93287","Anguilla"
"65A7FBDF-A882-4F31-8DD6-7AC8313936A9","Jessamine","Kent","WgGzJXLBB","et nec sociis ante ac non sem Phasellus porta pulvinar dui sodales ullamcorper gravida suscipit tristique","Mariko@fermentum.net","7491610","6376619.10","11/7/2016 8:49:29","314-127-7037","4178 West China Blvd.","Longview","NH","48732","Swaziland"
"9E9C63BE-A5E8-43C3-BA39-C7A02E23C182","Erich","Guerrero","cbmjjRgHmRmVTWn","sem ridiculus imperdiet volutpat Class primis taciti Fusce Aliquam arcu Aliquam","Alika@adipiscing.gov","654909","11243044.31","11/10/2016 17:32:14","589-562-0610","53154 North Cambridge Way","Agat","WA","14046","Afghanistan"
"B53FF68F-FA8A-4B48-B285-5ECDDA7FCFAF","Calvin","Guerrero","ajOpXNhcljyXMZe","tortor","Victor@dis.edu","749126","15621432.22","11/4/2016 17:58:20","133-444-6272","17121  Saint Lucia Ct.","Peabody","NH","92263","Netherlands"
"8FDE6E5C-2325-454E-8F51-4CEAE4428696","Ahmed","Avery","ydbIyHwB","arcu dictum dictum aptent lectus neque conubia rhoncus Suspendisse sodales quis ac Aliquam id ornare commodo","Igor@habitant.edu","7279355","9640812.08","11/3/2016 9:12:48","642-603-9030","31178 North Bahrain Ln.","Lawton","NM","75039","Thailand"
"6D6AE7C2-AF8F-47C2-82D0-6527F9E87D5C","Kyle","Dejesus","KyHwbxLTNl","libero mollis quis non tortor leo elementum justo porta turpis sit dis Suspendisse Donec","Hamilton@ut.us","6546326","11171758.61","11/7/2016 8:25:32","021-347-8700","97776  Norfolk Island Ct.","Annapolis","CA","24083","Jamaica"
"C05064B8-E14C-4E69-B020-02D2DB91A374","Reese","Blackburn"," brEZFMImNn","et","Rogan@velit.gov","9510588","6091054.38","11/5/2016 11:29:53","922-322-5950","79790 North Bosnia and Herzegovina Blvd.","Sunnyvale","AK","23288","Liberia"
"6DD94EC5-647B-4940-8C97-E3ED9EA6A060","Brendan","Lester","PvKqAWNQof","Fusce sollicitudin Quisque aliquam luctus pulvinar Nulla eget purus Cras non tellus malesuada orci conubia in sapien","Kylan@inceptos.net","9988686","1956087.37","11/3/2016 4:56:05","841-668-0814","63906 South Samoa Ln.","Minnetonka","NY","57801","New Caledonia"
"BA2345B5-B0B3-4CF0-9AA1-7FB34205FBB1","Sebastian","James","gsyeMldguTOndvv","Nam ultrices dolor lacinia","Kyra@urna.org","6371141","2938387.46","11/9/2016 7:48:53","825-651-8083","95178 South Ireland St.","Hartford","AK","22586","Eritrea"
"1E758B15-A192-4D02-BE1C-7DC50BEE8C94","Eagan","Macias","yEgYGlWUu deFX","Curabitur luctus dis porttitor orci morbi porttitor nulla massa vestibulum vitae lobortis litora vitae mollis","Kelly@orci.gov","6082743","19683281.74","11/3/2016 21:35:40","067-676-9623","85986 West Marshall Islands St.","Hilo","MT","50512","Chad"
"EEC6AE65-345C-4804-85DE-CB2833798B07","Lysandra","Knight","BHqbWCLTT","id risus nibh volutpat Quisque Etiam facilisi vulputate Nulla Maecenas penatibus mi ut","Glenna@venenatis.gov","5137628","11217836.46","11/10/2016 3:16:57","426-980-0332","96420 South Malawi Ct.","Vicksburg","OR","39087","Syrian Arab Republic"
"638CACC1-40DB-4B8F-8BD4-4BBF6242E999","Cruz","Maxwell","LiChGrVqXL","Curabitur Vestibulum","Belle@id.com","8128489","16821821.72","11/8/2016 5:36:13","745-498-2886","48078 North Bartlesville St.","Corry","PA","11496","Bosnia and Herzegovina"
"F64754F0-E2B7-44EE-8437-94007A889C6E","Sebastian","Rose","tYStqrHMvRINl","pharetra","Aaron@ultrices.org","6499008","4869251.33","11/7/2016 7:03:07","216-431-0065","49103  Austria Ave.","Topeka","KY","19444","Ethiopia"
"955A67A2-E978-479C-8E06-B35EF524438B","Maisie","Wheeler","TFoDhasV","litora Donec sodales pede Vestibulum gravida Cum feugiat Etiam Cras eu","Quail@blandit.edu","7873246","2100821.64","11/9/2016 4:49:57","801-921-2063","61506  Bosnia and Herzegovina Ln.","San Rafael","UT","71197","Liechtenstein"
"EE8C029C-3B07-466F-932A-FD1CFCF61B07","Aimee","Aguilar","USszIDVZkXrn","odio Morbi sollicitudin","Kessie@vel.com","2189162","19294948.32","11/7/2016 20:12:53","430-208-3219","8301  Saudi Arabia Blvd.","Bristol","IL","80313","Morocco"
"F1B9630D-D393-4F8D-8E73-9B4E9D8161BF","George","Lyons"," ZZTYwzPJ","imperdiet sociis iaculis dignissim tortor Maecenas In inceptos elementum dignissim dapibus sollicitudin Aliquam pharetra est rhoncus","Jaime@aptent.net","4809985","5878669.75","11/8/2016 10:40:25","756-151-4852","47007 East Eugene Ln.","Visalia","KY","37442","Morocco"
"2543B418-53C1-4B6F-B142-4DC177561C14","Rebekah","Taylor","jsgOZeGHbz","ridiculus mi augue quis dui ullamcorper volutpat Sed volutpat lorem Sed diam Curae sagittis sociis placerat scelerisque varius","Branden@Donec.com","1116005","13249632.01","11/5/2016 0:19:42","686-758-5192","1571 West Bulgaria Blvd.","Port Huron","ND","31989","Morocco"
"D76CC879-C3A8-4701-B017-88645AA1BC94","Gil","Guy","dDgmppSGIucliKA","aliquet aliquam Vivamus Quisque sagittis venenatis nisi eleifend massa eu fringilla metus lorem felis","Meredith@Fusce.org","3154805","1740954.09","11/3/2016 6:09:34","507-700-2794","7319 West Concord Blvd.","Akron","AK","82776","Venezuela"
"710DA853-A340-4DAD-B1D1-FB1F56F39789","Claudia","Oliver","YWbkysOrJ","parturient","Caldwell@lacus.com","2594427","17913617.87","11/10/2016 22:39:54","495-685-4561","44233  Bangladesh Way","Sanford","MT","26905","Svalbard and Jan Mayen"
